Data Analysis with Python Project ,,Intermediate level,18 hours (approximately),Flexible schedule,,"Define the scope and direction of a data analysis project, identifying appropriate techniques and methodologies for achieving project objectives. Apply various classification and regression algorithms and implement cross-validation and ensemble techniques to enhance the performance of models.Apply various clustering, dimension reduction association rule mining, and outlier detection algorithms for unsupervised learning models.","['Unsupervised Learning', 'Machine Learning', 'Supervised Learning', 'Project Planning', 'Data Mining']","['Data Analysis Overview', 'Classification Analysis', 'Regression Analysis', 'Clustering Analysis', 'Dimension Reduction', 'Association Rules', 'Outlier Detection']",['Di Wu'],['University of Colorado Boulder'],Math and Logic,https://www.coursera.org/learn/data-analysis-python-project
Audit System with Spring Boot AOP,,Intermediate level,1 hour,,,"Understand Aspect Oriented Programming, it's Key Terminologies and different types of Advices in Spring Boot AOP.Create Audit System to audit normal events such as new employee addition by using After Retuning Advice.Create Audit System to audit exception events where someone tries to update an non-existing employee by using After Throwing Advice.","['Application Design', 'Microservices', 'Spring Boot', 'Spring Boot AOP', 'Audit System']",['Learn step-by-step'],['Samarth Narula'],['Coursera Project Network'],Math and Logic,https://www.coursera.org/projects/audit-system-with-spring-boot-aop
Advanced Learning Algorithms,4.9,Beginner level,34 hours (approximately),Flexible schedule,"4,555 reviews","Build and train a neural network with TensorFlow to perform multi-class classificationApply best practices for machine learning development so that your models generalize to data and tasks in the real worldBuild and use decision trees and tree ensemble methods, including random forests and boosted trees","['Tensorflow', 'Advice for Model Development', 'Artificial Neural Network', 'Xgboost', 'Tree Ensembles']","['Neural Networks', 'Neural network training', 'Advice for applying machine learning', 'Decision trees']","['Andrew Ng', 'Aarti Bagul', 'Eddy Shyu', 'Geoff Ladwig']","['DeepLearning.AI', 'Stanford University']",Math and Logic,https://www.coursera.org/learn/advanced-learning-algorithms
Introduction to Electronics,4.7,,Approx. 46 hours to complete,Flexible schedule,"2,447 reviews",,[],"['Introduction and Review', 'Op Amps Part 1', 'Op Amps Part 2', 'Diodes Part 1', 'Diodes Part 2', 'MOSFETs', 'Bipolar Junction Transistors']","['Dr. Bonnie H. Ferri', 'Dr. Robert Allen Robinson, Jr.']",['Georgia Institute of Technology'],Math and Logic,https://www.coursera.org/learn/electronics
Introduction to Philosophy,4.7,,Approx. 19 hours to complete,Flexible schedule,"9,048 reviews",,[],"['What is Philosophy?', 'Morality: Objective, Relative or Emotive?', 'What is Knowledge? And Do We Have Any?', 'Week 2 review: Lesson Choices', 'Do We Have an Obligation to Obey the Law?', 'Should You Believe What You Hear?', 'Week 3 review: Lesson Choices', 'Minds, Brains and Computers', 'Are Scientific Theories True?', 'Week 4 review: Lesson Choices', 'Do We Have Free Will and Does It Matter?', 'Time Travel and Philosophy ', 'Week 5 review: Lesson Choices', 'Peer review']","['Guy Fletcher', 'Dr. Allan Hazlett', 'Dr. Matthew Chrisman', 'Elinor Mason', 'Dr. Suilin Lavelle', 'Dr. Alasdair Richmond', 'Professor Duncan Pritchard', 'Dr.  Dave Ward', ' Professor Michela Massimi']",['The University of Edinburgh'],Math and Logic,https://www.coursera.org/learn/philosophy
Value Chain Management Specialization,4.7,Intermediate level,3 months at 10 hours a week,Flexible schedule,"2,719 reviews",,"['Lean Manufacturing', 'Program Management', 'Six Sigma', 'Process Control', 'Accounting', 'Cost', 'Investment', 'Analysis Of Variance (ANOVA)', 'Process Analytics', 'Supply Chain', 'Inventory', 'Operations Strategy', 'Market Analysis', 'Marketing', 'Marketing Strategy', 'Marketing Mix', 'Marketing Plan', 'Marketing Management', 'Writing', 'Management Accounting', 'Cost Accounting', 'Activity Based Costing']","['Managerial Accounting: Cost Behaviors, Systems, and Analysis', 'Managerial Accounting: Tools for Facilitating and Guiding Business Decisions', 'Operations Management: Organization and Analysis', 'Operations Management: Quality and Supply Chain', 'Developing a Winning Marketing Strategy', 'Developing a Marketing Mix for Growth']","['Gopesh Anand', 'Gary Hecht, Ph.D.', 'Ujjal Kumar Mukherjee', 'Joe A. Bradley', 'Hayden Noel']",['University of Illinois at Urbana-Champaign'],Math and Logic,https://www.coursera.org/specializations/value-chain-management
Digital Signal Processing Specialization,4.6,Intermediate level,2 months at 10 hours a week,Flexible schedule,405 reviews,Discover discrete-time signal and analyze them with the Fourier transform.Learn to manipulate signals with filters.Move back and forth from the analog to the digital world.Learn about digital data communication and real-time DSP.,"['Fourier Analysis', 'Audio processing', 'Ipython', 'Convulsion', 'Data Transmission']","['Digital Signal Processing 1: Basic Concepts and Algorithms', 'Digital Signal Processing 2: Filtering', 'Digital Signal Processing 3: Analog vs Digital', 'Digital Signal Processing 4: Applications']","['Paolo Prandoni', 'Martin Vetterli']",['École Polytechnique Fédérale de Lausanne'],Math and Logic,https://www.coursera.org/specializations/digital-signal-processing
Programación en Python,4.5,Beginner level,Approx. 59 hours to complete,Flexible schedule,125 reviews,"Comprender y usar conceptos de programación como algoritmo, variable, función, parámetro, estructura de control y de datos e implementarlos en PythonDiseñar, crear y probar programas completos en Python para resolver problemas de la vida realManejar archivos y estructuras de datos complejas para manipular grandes volúmenes de informaciónUtilizar librerías especializadas como pandas y matplotlib para manipular conjuntos de datos y visualizarlos","['Python Programming', 'Pensamiento computacional', 'Abstracción', 'Programación', 'Diseño de software']","['Módulo 1: Descubriendo el mundo de la programación', 'Módulo 2: Tomando decisiones', 'Módulo 3: Repitiendo acciones y manejando estructuras de datos', 'Módulo 4: Solucionando problemas con matrices y librerías']","['Mario Sánchez Puccini', 'Natalia Franco', 'Marcela Hernández Hoyos', 'Andrés Felipe Melani De La Hoz', 'Andrea Herrera Suescún']",['Universidad de los Andes'],Math and Logic,https://www.coursera.org/learn/programacion-python
Excel Skills for Business: Intermediate II,4.8,Intermediate level,28 hours (approximately),Flexible schedule,"7,958 reviews",,"['Lookup Table', 'Microsoft Excel Vba', 'Data Validation', 'Microsoft Excel Macro']","['Data Validation', 'Conditional Logic', 'Automating Lookups', 'Formula Auditing and Protection', 'Data Modelling', 'Recording Macros', 'Final Assessment']","['Nicky Bull', 'Dr Prashan S. M. Karunaratne', 'Professor Yvonne Breyer']",['Macquarie University'],Math and Logic,https://www.coursera.org/learn/excel-intermediate-2
Prediction and Control with Function Approximation,4.8,Intermediate level,21 hours (approximately),Flexible schedule,797 reviews,,"['Function Approximation', 'Artificial Intelligence (AI)', 'Reinforcement Learning', 'Machine Learning', 'Intelligent Systems']","['Welcome to the Course!', 'On-policy Prediction with Approximation', 'Constructing Features for Prediction', 'Control with Approximation ', 'Policy Gradient']","['Adam White', 'Martha White']","['University of Alberta', 'Alberta Machine Intelligence Institute']",Math and Logic,https://www.coursera.org/learn/prediction-control-function-approximation
Gestão de Operações,4.8,Beginner level,Approx. 18 hours to complete,Flexible schedule,517 reviews,,[],"['Boas-Vindas', 'Introdução à Gestão de Operações', 'Estratégia de Operações', 'Gestão da Qualidade e das Melhorias', 'Gestão de Processos', 'Gestão e Controle de Estoques', 'Fechamento do Curso']",['André Luís de Castro Moura Duarte'],['Insper'],Math and Logic,https://www.coursera.org/learn/gestao-de-operacoes
Fundamentals of Java Programming,4.3,Beginner level,17 hours (approximately),Flexible schedule,79 reviews,"Master the core components of Java programming such as syntax, variables, methods, control statements, and understand JVM, JRE, and JDK. Develop proficiency in writing Java code with an understanding of operators, loops, conditionals, & arrays, enabling creation of robust application. Grasp advanced object-oriented programming concepts like inheritance, polymorphism, and encapsulation to develop efficient and reusable Java code. Enhance your coding by mastering advanced exception-handling techniques, creating custom exceptions, and managing multiple exceptions in Java. ","['Algorithms', 'Java Syntax', 'Java Programming', 'Data Structure Implementation', 'Object-Oriented Programming (OOP)']","['Java Fundamentals', 'Core Java', 'OOPS and Other Essential Concepts']",['Board Infinity'],['Board Infinity '],Math and Logic,https://www.coursera.org/learn/fundamentals-of-java-programming
Machine Learning Using SAS Viya,4.7,Intermediate level,Approx. 33 hours to complete,Flexible schedule,100 reviews,,[],"['Course Overview', 'Getting Started with Machine Learning using SAS®  Viya', 'Data Preparation and Algorithm Selection', 'Decision Trees and Ensembles of Trees', 'Neural Networks', 'Support Vector Machines', 'Model Deployment', 'Additional Resources and Practice Exam']","['Catherine Truxillo', 'Jeff Thompson']",['SAS'],Math and Logic,https://www.coursera.org/learn/machine-learning-sas
An Introduction to Programming using Python,4.7,Beginner level,Approx. 9 hours to complete,Flexible schedule,37 reviews," Describe what computer programming is, recognising its purpose and how it enables the creation and execution of computer programs.  Explain what algorithms are and their significance in programming. Create programs that accept user input, display output, and utilise essential programming constructs such as if statements, loops, and functions. Gain digital skills as part of Click Start! Follow the link in the instructor bio to see if you're eligible for FREE access to this course and more..","['Programming Principles', 'Python Programming', 'Coding']","['Week 1: Programming fundamentals in Python', 'Week 2']","['Dr Rafael Papallas', 'Click Start']",['University of Leeds'],Math and Logic,https://www.coursera.org/learn/an-introduction-to-programming-using-python
"Securing Software, Data and End Points",4.8,Beginner level,7 hours (approximately),Flexible schedule,24 reviews,,['Security Software'],"['Module 1: Securing Software', 'Module 2: Securing Data', 'Module 3: Identify and Analyze Malicious Code and Activity', 'Module 4: Implement and Operate Endpoint Security', 'Module 5: Operate and Secure Virtual Environments', 'Module 6: Chapter 4 Review']",['(ISC)² Education & Training'],['ISC2'],Math and Logic,https://www.coursera.org/learn/sscp-4th-ed-course-4
Trees and Graphs: Basics,4.7,Advanced level,34 hours (approximately),Flexible schedule,83 reviews,Define basic tree data structures and identify algorithmic functions associated with themExecute traversals and create graphs within a binary search tree structureDescribe strongly connected components in graphs,"['Algorithm Design', 'Python Programming', 'Data Structure Design', 'Analysis of Algorithms', 'Graphs Algorithms']","['Binary Search Trees and Algorithms on Trees', 'Basics of Graphs and Graphs Traversals', 'Union-Find Data Structures and Spanning Tree Algorithms', 'Shortest Path Algorithms']",['Sriram Sankaranarayanan'],['University of Colorado Boulder'],Math and Logic,https://www.coursera.org/learn/trees-graphs-basics
Inequality and Democracy,4.8,Beginner level,Approx. 20 hours to complete,Flexible schedule,28 reviews,,"['Philosophy', 'Economics', 'History', 'Political Science', 'Law']","['Economic inequality', 'Property and corporations', 'Democracy', 'Lobbying and campaign finance', 'Capital flight and tax avoidance', 'Alternative economic institutions']","['Yara Salman', 'Michael Bennett', 'Rutger Claassen']",['Utrecht University'],Math and Logic,https://www.coursera.org/learn/inequality-and-democracy
Programación en Python II: aprendiendo a estructurar datos,4.7,Intermediate level,Approx. 11 hours to complete,Flexible schedule,37 reviews,"Distinguir herramientas de modelamiento para programas más complejos, como herencia y polimorfismo.Utilizar estructuras de datos secuenciales y no secuenciales para el almacenamiento y consulta de datos en programas computaciones.      Construir tipos de datos propios sencillos, a través de conceptos de clases, objetos, atributos y métodos.Construir soluciones a problemas algorítmicos utilizando el modelo de programación recursiva.","['Python Programming', 'analysis']","['Introducción y bienvenida', 'Semana 1', 'Semana 2', 'Semana 3', 'Semana 4', 'Semana 5', 'Semana 6', 'Cierre']","['Valeria Herskovic', 'Cristian Ruz', 'Jorge Muñoz Gama']",['Pontificia Universidad Católica de Chile'],Math and Logic,https://www.coursera.org/learn/programacion-en-python-ii-aprendiendo-a-estructurar-datos
Renewable Energy Futures,4.8,Beginner level,16 hours (approximately),Flexible schedule,155 reviews,"How renewable energy's future is linked to other technologies, such as electricity storage and electric vehicles. How renewables' recent success is bringing new issues to light, such as electrification and electricity market design.Where renewable energy is headed, and how to get ahead of the trends.  ","['Renewable Energy', 'Hydrogen', 'Electric Vehicles', 'Climate Change', 'Energy storage']","['Introduction,  Energy Transitions, and Scenarios', 'Renewable Energy Technology Futures:  Wind, Solar PV, and More', 'Enabling Technologies for Renewable Energy', 'Emerging Issues and Concepts in Renewable Energy', 'Summary and Review']",['Paul Komor'],['University of Colorado Boulder'],Math and Logic,https://www.coursera.org/learn/renewable-energy-futures
Generalized Linear Models and Nonparametric Regression,4.3,Intermediate level,42 hours (approximately),Flexible schedule,12 reviews,"Describe how to generalize the linear model framework to accommodate data that is not suitable for the standard linear regression model.State some advantages and disadvantages of (generalized) additive models.Describe how an additive model can be generalized to incorporate non-normal response variables (i.e., define a generalized additive model).","['Calculus', 'and probability theory.', 'Linear Algebra']","['An Introduction to Generalized Linear Models Through Binomial Regression', 'Models for Count Data', 'Introduction to Nonparametric Regression', 'Introduction to Generalized Additive Models']",['Brian Zaharatos'],['University of Colorado Boulder'],Math and Logic,https://www.coursera.org/learn/generalized-linear-models-and-nonparametric-regression
Mathematical Foundations for Cryptography,4.6,Beginner level,14 hours (approximately),Flexible schedule,316 reviews,,[],"['Integer Foundations', 'Modular Exponentiation', 'Chinese Remainder Theorem', 'Primality Testing']","['Sang-Yoon Chang', 'Richard White', 'William Bahn']",['University of Colorado System'],Math and Logic,https://www.coursera.org/learn/mathematical-foundations-cryptography
Energy management for real estate. Methods and digital tools,4.5,Beginner level,Approx. 4 hours to complete,Flexible schedule,60 reviews, To identify the main role and duties of the energy manager  To know the current energy framework To assess the energy audit of the building  To perform a proper digital energy model of the buildings ,[],"['Introduction to the course', 'Energy framework and Buildings foundamentals', 'Energy management in buildings', 'Practical applications']",['Claudio Del Pero'],['Politecnico di Milano'],Math and Logic,https://www.coursera.org/learn/energy-management-for-real-estate
الإعلان من خلال فيسبوك,4.7,Beginner level,10 hours (approximately),Flexible schedule,18 reviews,إنشاء حملات في مدير إعلانات فيسبوكصمم إعلانًا يتوافق مع أهدافك التسويقية وقم بتوجيهه إلى الجمهور المراد استهدافهحدد الميزانية ومواضع ظهور الإعلانات وضعّ جدولاً للإعلانات في مدير إعلانات فيسبوككُنّ واحدًا من المساعدين المعتمدين في التسويق الرقمي بفيسبوك,"['Advertising', 'Budget', 'Evaluation', 'Advertising Campaign']","['الخطوات الأولى في مدير إعلانات فيسبوك', 'تحديد أهداف حملتك وميزانيتها', 'اختيار الجمهور والمنصات والجدول الزمني', 'إنشاء إعلاناتك وتقييم نتائج حملاتك', 'إعداد حملتك الخاصة في مدير الإعلانات']",['Daniel Kob'],['Meta'],Math and Logic,https://www.coursera.org/learn/al-ilan-min-khilal-facebook
Titanic Survival Prediction Using Machine Learning,4.8,Beginner level,2 hours,,12 reviews,"Understand the theory and intuition behind logistic regression classifier modelsBuild, train and test a logistic regression classifier model in Scikit-Learn Perform data cleaning, feature engineering and visualization","['Data Science', 'Python Programming', 'Machine Learning']",['Learn step-by-step'],['Ryan Ahmed'],['Coursera Project Network'],Math and Logic,https://www.coursera.org/projects/titanic-survival-prediction-using-machine-learning
Quantitative Model Checking,4.2,Intermediate level,Approx. 17 hours to complete,Flexible schedule,52 reviews,,[],"['Module 1: Computational Tree Logic', 'Discrete Time Markov Chains', 'Probabilistic Computational Tree Logic', 'Continuous Time Markov Chains', 'Continuous Stochastic Logic']",['Anne Remke'],['EIT Digital '],Math and Logic,https://www.coursera.org/learn/quantitative-model-checking
VLSI CAD Part I: Logic,4.7,Intermediate level,Approx. 23 hours to complete,Flexible schedule,533 reviews,,"['Logic Gate', 'Computer-Aided Design (CAD)', 'Digital Design', 'Boolean Algebra']","['Orientation', 'Computational Boolean Algebra', 'Boolean Representation via BDDs and SAT', '2-Level Logic Synthesis, and Multi-Level Logic Synthesis via the Algebraic Model', ""Multilevel Factor Extract and Don't Cares"", 'Final Exam']",['Rob A. Rutenbar'],['University of Illinois at Urbana-Champaign'],Math and Logic,https://www.coursera.org/learn/vlsi-cad-logic
Digital Systems: From Logic Gates to Processors,4.4,Intermediate level,Approx. 27 hours to complete,Flexible schedule,732 reviews,,"['Digital Design', 'Boolean Algebra', 'Processor Design', 'Digital Circuit Design']","['All you need to know to start the course', 'Previous knowledge: A review', 'What Digital Systems are?', 'Combinational Circuits (I)', 'VerilUOC_Desktop tools', 'Combinational circuits (II)', 'Arithmetic components + Introduction to VHDL', 'Sequential circuits (I)', 'Sequential circuits (II)', 'Sequential circuits III and Finite State Machines', 'Implementation of digital systems', 'COURSE SUMMARY AND FAREWELL']","['Joaquín Saiz Alcaine', 'Juan Antonio Martínez', 'Lluis Terés', 'Elena Valderrama', 'Jean-Pierre Deschamps', 'Merce Rullan', 'David Bañeres']",['Universitat Autònoma de Barcelona'],Math and Logic,https://www.coursera.org/learn/digital-systems
Google Project Management: Professional Certificate,4.8,Beginner level,6 months at 10 hours a week,Flexible schedule,"95,097 reviews","Gain an immersive understanding of the practices and skills needed to succeed in an entry-level project management roleLearn how to create effective project documentation and artifacts throughout the various phases of a projectLearn the foundations of Agile project management, with a focus on implementing Scrum events, building Scrum artifacts, and understanding Scrum rolesPractice strategic communication, problem-solving, and stakeholder management through real-world scenarios","['Project Management', 'Change Management', 'Strategic Thinking', 'Career Development', 'Organizational Culture', 'Risk Management', 'Quality Management', 'Project Execution', 'Agile Management', 'Problem Solving', 'Coaching', 'Scrum', 'Influencing', 'Effective Communication', 'Stakeholder Management', 'Business Writing', 'Project Charter', 'Procurement', 'Task Estimation', 'Project Planning']","['Foundations of Project Management', 'Project Initiation: Starting a Successful Project', 'Project Planning: Putting It All Together', 'Project Execution: Running the Project', 'Agile Project Management', 'Capstone: Applying Project Management in the Real World']",['Google Career Certificates'],['Google'],Math and Logic,https://www.coursera.org/professional-certificates/google-project-management
IBM Data Science Professional Certificate,4.6,Beginner level,5 months at 10 hours a week,Flexible schedule,"68,453 reviews","Master the most up-to-date practical skills and knowledge that data scientists use in their daily rolesLearn the tools, languages, and libraries used by professional data scientists, including Python and SQLImport and clean data sets, analyze and visualize data, and build machine learning models and pipelinesApply your new skills to real-world projects and build a portfolio of data projects that showcase your proficiency to employers","['Data Science', 'Big Data', 'Python Programming', 'Github', 'Machine Learning', 'Deep Learning', 'Methodology', 'SQL', 'Rstudio', 'Data Mining', 'Jupyter notebooks']","['What is Data Science? ', 'Tools for Data Science', 'Data Science Methodology', 'Python for Data Science, AI & Development', 'Python Project for Data Science', 'Databases and SQL for Data Science with Python', 'Data Analysis with Python', 'Data Visualization with Python', 'Machine Learning with Python', 'Applied Data Science Capstone']","['Aije Egwaikhide', 'Polong Lin', 'Rav Ahuja', 'Joseph Santarcangelo', 'Yan Luo', 'Azim Hirjani', 'Romeo Kienzler', 'Svetlana Levitan', 'Alex Aklson', 'SAEED AGHABOZORGI', 'Hima Vasudevan', 'Saishruthi Swaminathan', 'Dr. Pooja']",['IBM'],Math and Logic,https://www.coursera.org/professional-certificates/ibm-data-science
IBM DevOps and Software Engineering Professional Certificate,4.7,Beginner level,3 months at 10 hours a week,Flexible schedule,"2,846 reviews","Develop  a DevOps mindset, practice Agile philosophy & Scrum methodology -  essential to succeed in the era of Cloud Native Software EngineeringCreate applications using Python  language, using various programming constructs and logic, including functions, REST APIs, and  librariesBuild applications composed of microservices and deploy using containers (e.g. Docker, Kubernetes, and OpenShift) & serverless technologiesEmploy tools for automation, continuous integration (CI) and continuous deployment (CD) including Chef, Puppet, GitHub Actions, Tekton and  Travis. ","['Python Programming', 'Application development', 'Web Application', 'Flask', 'Artificial Intelligence (AI)', 'CI/CD', 'Microservices', 'Cloud Computing', 'Kubernetes', 'Devops', 'Software Testing', 'Test-Driven Development', 'Behavior-Driven Development', 'Test Case', 'Automated Testing', 'Kanban', 'Zenhub', 'Scrum Methodology', 'Agile Software Development', 'Sprint Planning', 'Representational State Transfer (REST)', 'Cloud Applications', 'Openshift', 'serverless', 'Docker', 'Containers', 'Cloud Native', 'agile', 'TDD/BDD', 'Observability', 'Telemetry', 'Monitoring', 'logging', 'Tracing', 'Distributed Version Control Systems (DVCS)', 'Git (Software)', 'Github', 'open source', 'Cloning and forking', 'Continuous Integration', 'Continuous Development', 'Infrastructure As Code', 'Automation', 'Hybrid Multicloud', 'Iaas PaaS Saas', 'Data Science', 'Data Analysis', 'Numpy', 'Pandas', 'Open Web Application Security Project (OWASP)', 'security', 'Shell Script', 'Bash (Unix Shell)', 'Extract Transform and Load (ETL)', 'Linux', 'Linux Commands']","['Introduction to DevOps', 'Introduction to Cloud Computing', 'Introduction to Agile Development and Scrum', 'Hands-on Introduction to Linux Commands and Shell Scripting', 'Getting Started with Git and GitHub', 'Python for Data Science, AI & Development', 'Developing AI Applications with Python and Flask', 'Introduction to Containers w/ Docker, Kubernetes & OpenShift', 'Application Development using Microservices and Serverless ', 'Introduction to Test and Behavior Driven Development', 'Continuous Integration and Continuous Delivery (CI/CD)', 'Application Security for Developers and DevOps Professionals', 'Monitoring and Observability for\xa0Development and DevOps', 'DevOps Capstone Project']","['John Rofrano', 'Alex Parker', 'Ramanujam Srinivasan', 'Rav Ahuja', 'Joseph Santarcangelo', 'Ramesh Sannareddy', 'Lavanya Thiruvali Sunderarajan', 'Sam Prokopchuk', 'Upkar Lidder', 'Abhishek Gagneja']",['IBM'],Math and Logic,https://www.coursera.org/professional-certificates/devops-and-software-engineering
