Course Title,Rating,Level,Duration,Schedule,Review,What you will learn,Skill gain,Modules,Instructor,Offered By,Keyword,Course Url
FPGA Design for Embedded Systems Specialization,4.5,Intermediate level,2 months at 10 hours a week,Flexible schedule,557 reviews,"Create in the FPGA a working system on a chip design with Nios II soft processor, RAM and FLASH memory, and several peripherals.Understand and practice all aspects of FPGA development, including conception, design, implementation, and debugging.Understand the rationale for each phase of the hardware development flow, including  fitting, timing constraints, simulation, and programming.Apply hierarchical design methods to create bigger designs in VHDL or Verilog","['Simulation for Verification', 'Programmable Logic Design', 'Writing Code in Verilog', 'VHDL Coding', 'Softcore Processor Design']","['Introduction to FPGA Design for Embedded Systems', 'Hardware Description Languages for FPGA Design', 'FPGA Softcore Processors and IP Acquisition', 'FPGA Capstone:  Building FPGA Projects']","['Benjamin Spriggs', 'Timothy Scherr']",['University of Colorado Boulder'],Physical Science and Engineering,https://www.coursera.org/specializations/fpga-design
Optical Engineering Specialization,4.3,Advanced level,2 months at 10 hours a week,Flexible schedule,313 reviews,"Specify an optical system and potential solutions to meet those specsTransform layouts into optical designs including real optical componentsAnalyze you designs in an industry standard optical design code, OpticStudio by Zemax,  to validate and optimize the design","['optical system specification', 'optimization of optical systems', 'optical design']","['First Order Optical System Design', 'Optical Efficiency and Resolution', 'Design of High-Performance Optical Systems']",['Robert McLeod'],['University of Colorado Boulder'],Physical Science and Engineering,https://www.coursera.org/specializations/optical-engineering
Renewable Energy Specialization,4.8,Beginner level,1 months at 10 hours a week,Flexible schedule,472 reviews,"Understand and evaluate the operations and performance of renewable energy technologies.Explain how renewable energy systems integrate with electricity grid operations and market structures.Explore how issues such as electric vehicles, hydrogen, and storage will influence renewable energy, and assess future pathways for renewables.","['Wind Energy', 'Sustainability', 'Renewable Energy', 'Solar Energy', 'Energy Projects']","['Renewable Energy Technology Fundamentals', 'Renewable Power and Electricity Systems', 'Renewable Energy Projects', 'Renewable Energy Futures']","['Stephen R. Lawrence', 'Paul Komor']",['University of Colorado Boulder'],Physical Science and Engineering,https://www.coursera.org/specializations/renewable-energy
Algorithms for Battery Management Systems Specialization,4.8,Intermediate level,3 months at 10 hours a week,Flexible schedule,"1,659 reviews",How to design equivalent-circuit models for lithium-ion battery cellsHow to implement state-of-charge (SOC) estimators for lithium-ion battery cellsHow to implement state-of-health (SOH) estimators for lithium-ion battery cellsHow to design balancers and power-limits estimators for lithium-ion battery packs,"['Implement state-of-health estimators for lithium-ion battery cells', 'Design equivalent-circuit models for lithium-ion battery cells', 'Implement state-of-charge estimators for lithium-ion battery cells', 'Understand how lithium-ion battery cells work and basic requirements of battery-management systems', 'Understand balancing requirements and implement power estimators for lithium-ion battery packs']","['Introduction to battery-management systems', 'Equivalent Circuit Cell Model Simulation', 'Battery State-of-Charge (SOC) Estimation', 'Battery State-of-Health (SOH) Estimation', 'Battery Pack Balancing and Power Estimation']",['Gregory Plett'],"['University of Colorado System', 'University of Colorado Boulder']",Physical Science and Engineering,https://www.coursera.org/specializations/algorithms-for-battery-management-systems
Robotics Specialization,4.3,Beginner level,3 months at 10 hours a week,Flexible schedule,"3,058 reviews",Motion PlanningMatlabEstimation,"['Motion Planning', 'Particle Filter', 'Matlab']","['Robotics: Aerial Robotics', 'Robotics: Computational Motion Planning', 'Robotics: Mobility', 'Robotics: Perception', 'Robotics: Estimation and Learning', 'Robotics: Capstone']","['Jianbo Shi', 'CJ Taylor', 'Daniel E. Koditschek', 'Sid Deliwala', 'Kostas Daniilidis', 'Daniel Lee', 'Vijay Kumar']",['University of Pennsylvania'],Physical Science and Engineering,https://www.coursera.org/specializations/robotics
Autodesk CAD/CAM/CAE for Mechanical Engineering Specialization,4.8,Intermediate level,1 months at 10 hours a week,Flexible schedule,"3,658 reviews",Demonstrate creative confidence when choosing a design strategy for developing mechanical designs based on engineering requirements.Prepare designs for manufacture applying industry-based computer-aided manufacturing skills and manufacturing principles.Create adaptive toolpaths to remove material from designs efficiently.Demonstrate simulation driven design (SDD) for new product development.,"['Computer-Aided Manufacturing', 'Mechanical Engineering', 'Computer-Aided Engineering (CAE)', 'Manufacturing Process Management', 'Computed Aided Design']","['Introduction to Mechanical Engineering Design and Manufacturing with Fusion 360', 'Modeling and Design for Mechanical Engineers with Autodesk Fusion 360', 'Simulation Analysis for Mechanical Engineers with Autodesk Fusion 360', 'CAM and Design Manufacturing for Mechanical Engineers with Autodesk Fusion 360']",[],['Autodesk'],Physical Science and Engineering,https://www.coursera.org/specializations/autodesk-cad-cam-cae-mechanical-engineering
An Introduction to Programming the Internet of Things (IOT) Specialization,4.7,Beginner level,2 months at 10 hours a week,Flexible schedule,"12,195 reviews",,"['Arduino', 'Python Programming', 'Internet Of Things (IOT)', 'Raspberry Pi']","['Introduction to the Internet of Things and Embedded Systems', 'The Arduino Platform and C Programming', 'Interfacing with the Arduino', 'The Raspberry Pi Platform and Python Programming for the Raspberry Pi', 'Interfacing with the Raspberry Pi', 'Programming for the Internet of Things Project']",['Ian Harris'],"['University of California, Irvine']",Physical Science and Engineering,https://www.coursera.org/specializations/iot
Power Electronics Specialization,4.8,Intermediate level,2 months at 10 hours a week,Flexible schedule,"3,066 reviews",,"['Understand the fundamentals of magnetic components including inductors and transformers', 'Design and optimize inductors and transformers for switched-mode power converters', 'Analyze and model losses in magnetic components']","['Introduction to Power Electronics', 'Converter Circuits', 'Converter Control', 'Magnetics for Power Electronic Converters']",['Dr. Robert Erickson'],['University of Colorado Boulder'],Physical Science and Engineering,https://www.coursera.org/specializations/power-electronics
CAD and Digital Manufacturing Specialization,4.7,Intermediate level,2 months at 10 hours a week,Flexible schedule,"3,820 reviews",,"['Computer-Aided Design (CAD)', 'Autodesk', 'Manufacturing Processes', 'Sustainable Design']","['Intro to Digital Manufacturing with Autodesk Fusion 360', 'Autodesk Fusion 360 Integrated CAD/CAM/CAE', '3D Model Creation with Autodesk Fusion 360', 'Engineering Design Process with Autodesk Fusion 360', 'Manufacturing Process with Autodesk Fusion 360']",[],['Autodesk'],Physical Science and Engineering,https://www.coursera.org/specializations/cad-design-digital-manufacturing
Fundamentals of Engineering Exam Review,4.7,,Approx. 21 hours to complete,Flexible schedule,603 reviews,,[],"['ABOUT THIS COURSE', 'Mathematics', 'Probability and Statistics', 'Statics', 'Mechanics of Materials', 'Fluid Mechanics', 'Hydraulics and Hydrologic Systems', 'Structural Analysis']",['Dr. Philip Roberts'],['Georgia Institute of Technology'],Physical Science and Engineering,https://www.coursera.org/learn/fe-exam
Introduction to Electronics,4.7,,Approx. 46 hours to complete,Flexible schedule,"2,447 reviews",,[],"['Introduction and Review', 'Op Amps Part 1', 'Op Amps Part 2', 'Diodes Part 1', 'Diodes Part 2', 'MOSFETs', 'Bipolar Junction Transistors']","['Dr. Bonnie H. Ferri', 'Dr. Robert Allen Robinson, Jr.']",['Georgia Institute of Technology'],Physical Science and Engineering,https://www.coursera.org/learn/electronics
"Introduction to Biology: Ecology, Evolution, & Biodiversity Specialization",4.9,Beginner level,4 months at 3 hours a week,Flexible schedule,72 reviews,,"['Recording observations', 'Ecosystem Model', 'Examining ideas', 'Interpreting phylogenetic trees', 'Inspecting specimens', 'Researching scientific articles', 'Identifying species', 'Interdisciplinary thinking', 'Communicating scientific ideas', 'Concept mapping and visualization']","['Introduction to Biology: Ecology', 'Introduction to Biology: Evolution', 'Introduction to Biology: Biodiversity']",['Scott Solomon'],['Rice University'],Physical Science and Engineering,https://www.coursera.org/specializations/introduction-to-biology
Introduction to Engineering Mechanics,4.8,,Approx. 15 hours to complete,Flexible schedule,"4,775 reviews",,[],"['Forces and Particle Equilibrium', 'Define and Calculate Moments', 'Equilibrium and Equivalence of Force Systems', 'Free Body Diagrams and Equilibrium Analysis Techniques', 'Application of Static Equilibrium Equations']","['Dr. Wayne Whiteman, PE']",['Georgia Institute of Technology'],Physical Science and Engineering,https://www.coursera.org/learn/engineering-mechanics-statics
Electric Industry Operations and Markets,4.8,Beginner level,Approx. 7 hours to complete,Flexible schedule,"1,237 reviews",,[],"['Electric Industry Operations', 'Electricity Industry Markets']",['Lincoln Pratson'],['Duke University'],Physical Science and Engineering,https://www.coursera.org/learn/electricity
Embedding Sensors and Motors Specialization,4.6,Intermediate level,4 months at 10 hours a week,Flexible schedule,"1,119 reviews",Study a lab experiment or production process and understand how to specify the proper sensor solution for taking real-time process dataImplement the sensor into an embedded system in both hardware and softwareModify existing hardware schematic to add sensors and all support circuitry needed to implement the signal chain in existing microprocessor systemCreate hardware and firmware to process the sensor signal and feed data to a microprocessor for further evaluation,"['firmware', 'embedded engineering', 'hardware', 'sensor integration', 'motor design']","['Sensors and Sensor Circuit Design', 'Motors and Motor Control Circuits', 'Pressure, Force, Motion, and Humidity Sensors ', 'Sensor Manufacturing and Process Control']","['James Zweighaft', 'Jay Mendelson']",['University of Colorado Boulder'],Physical Science and Engineering,https://www.coursera.org/specializations/embedding-sensors-motors
Oil & Gas Industry Operations and Markets ,4.8,,Approx. 7 hours to complete,Flexible schedule,"5,729 reviews",,"['Energy', 'Geology', 'Directional Drilling', 'Enhanced Oil Recovery']","['Oil and Gas Operations and Technology', 'Oil and Gas Industry Markets']",['Lincoln Pratson'],['Duke University'],Physical Science and Engineering,https://www.coursera.org/learn/oilandgas
"Ethics, Technology and Engineering ",4.6,Beginner level,Approx. 19 hours to complete,Flexible schedule,712 reviews,,[],"['Introduction', 'The responsibility of engineers', 'Codes of conduct', 'Normative ethics', 'The ethical cycle', 'Ethical questions in the design of technology', 'Designing morality', 'Ethical aspects of technological risks', 'Distribution of responsibility', 'Exam']",['Lambèr Royakkers'],"['Eindhoven University of Technology', '4TU.Ethics']",Physical Science and Engineering,https://www.coursera.org/learn/ethics-technology-engineering
Wind Energy,4.7,,Approx. 34 hours to complete,Flexible schedule,"7,069 reviews",,"['Wind Energy', 'Materials', 'Wind Power', 'Wind Energy Engineering']","[' About this course', 'Wind Energy Economics: Value creation and metrices', 'Introduction to Wind Atlases and the Global Wind Atlas', 'Wind Farm Design and Optimization', 'Forecasting of Wind Power ', 'How and Why we measure the wind', 'Remote sensing for wind energy', 'Load measurements on wind turbines', 'One-Dimensional Momentum Theory and the Betz Limit for Maximum Power Production', 'Different Methods and Concepts for Harvesting Wind Energy', 'Composite Materials for Wind Energy ', 'Fatigue Phenomenon and Life Prediction', 'Blade Testing and Modeling', 'Blade design and manufacturing', 'Introduction to HVDC', 'Influence of fluctuating wind speed on system frequency and frequency control']","['Cathy Suo', 'Mac Gaunaa', 'Katherine Dykes', 'Mikael Sjöholm', 'Xiao Chen', 'Kenneth Thomsen', 'Xiaoli Guo Larsén', 'Jens Nørkær Sørensen', 'Martin Eder', 'Lena Kitzing', 'Lars Pilgaard Mikkelsen', 'Mike Courtney', 'Gregor Giebel', 'Jake Badger', 'Philipp Ulrich Haselbach', 'Hjörtur Jóhannsson']",['Technical University of Denmark (DTU)'],Physical Science and Engineering,https://www.coursera.org/learn/wind-energy
Fundamentals of GIS,4.8,Beginner level,26 hours (approximately),Flexible schedule,"5,472 reviews",Define core geospatial conceptsPractice with subset data using selections and feature attributesCreate map books using advanced mapping techniquesCreate layer and map packages,"['Spatial Analysis', 'Data Analysis', 'Data Visualization', 'Software']","['Course Introduction and Introduction to Geographic Information Systems (GIS)', 'ArcGIS Basics', 'Making Maps With Common Datasets', 'Retrieving and Sharing Data']","['Eric Howard', 'Nick Santos']","['University of California, Davis']",Physical Science and Engineering,https://www.coursera.org/learn/gis
Circular Economy - Sustainable Materials Management,4.8,Beginner level,Approx. 19 hours to complete,Flexible schedule,"1,814 reviews",,"['Environmental Policy', 'Policy Analysis', 'Business Model', 'Business Analysis', 'Material Design']","['Introduction - Materials', 'Circular Business Models', 'Circular Design, Innovation and Assessment', 'Policies and Networks', 'Circular Societies']","['Jeroen Gillabel', 'Dr. Yuliya Voytenko Palgan', 'Philip Peck', 'Jessika Luth Richter', 'Karl Vrancken', 'Sophie Sfez', 'Katherine Whalen', 'Julia Nußholz', 'Erika Faigen', 'David Peck', 'Konstantinos Modis', 'Saskia Manshoven']","['Lund University', 'EIT RawMaterials', 'VITO', 'Geological Survey of Denmark and Greenland', 'National Technical University of Athens', 'Ghent University', 'Delft University of Technology']",Physical Science and Engineering,https://www.coursera.org/learn/circular-economy
Autodesk CAD/CAM for Manufacturing Specialization,4.8,Intermediate level,2 months at 10 hours a week,Flexible schedule,644 reviews,"Summarize an understanding of computer aided design, manufacturing, and toolpath creation.   Practice design-related vocabulary and visual literacy to articulate your process and decisions.Demonstrate creative confidence and practice job ready CAD skills and CAM using Autodesk Fusion 360 software.","['Computer-Aided Manufacturing', 'Computer-Aided Design (CAD)', 'Autodesk', 'Mechanical Engineering', 'Manufacturing Processes']","['Introduction to CAD, CAM, and Practical CNC Machining', '3-Axis Machining with Autodesk Fusion 360', 'Creating Toolpaths for a CNC Lathe', 'Multi-Axis CNC Toolpaths']",[],['Autodesk'],Physical Science and Engineering,https://www.coursera.org/specializations/autodesk-cad-cam-manufacturing
Digital Signal Processing Specialization,4.6,Intermediate level,2 months at 10 hours a week,Flexible schedule,405 reviews,Discover discrete-time signal and analyze them with the Fourier transform.Learn to manipulate signals with filters.Move back and forth from the analog to the digital world.Learn about digital data communication and real-time DSP.,"['Fourier Analysis', 'Audio processing', 'Ipython', 'Convulsion', 'Data Transmission']","['Digital Signal Processing 1: Basic Concepts and Algorithms', 'Digital Signal Processing 2: Filtering', 'Digital Signal Processing 3: Analog vs Digital', 'Digital Signal Processing 4: Applications']","['Paolo Prandoni', 'Martin Vetterli']",['École Polytechnique Fédérale de Lausanne'],Physical Science and Engineering,https://www.coursera.org/specializations/digital-signal-processing
Battery Technologies Specialization,4.7,Beginner level,1 months at 10 hours a week,Flexible schedule,49 reviews," Course 1: Participants will learn basic operating principles of battery design for maximizing energy and power density for automotive applications.Course 2: Participants will learn active material, chemistry and manufacturing processes in various Zn and Ni battery selection and size application.Course 3: Participants will learn active materials, chemistry and manufacturing processes as they relate to Li based primary batteries.Course 4: Participants will learn components of battery management systems, cell balancing, state of charge and state of health estimation.","['battery management systems', 'battery charging', 'Electric Vehicles', 'battery types']","['Primary and Secondary Batteries', 'Zn and Ni Based Batteries', 'Lithium Based Batteries', 'Battery Comparison, Manufacturing, and Packaging', 'Batteries and Electric Vehicles']",['Arunachala Nadar Mada Kannan'],['Arizona State University'],Physical Science and Engineering,https://www.coursera.org/specializations/battery-technologies
Understanding Einstein: The Special Theory of Relativity,4.9,Beginner level,Approx. 80 hours to complete,Flexible schedule,"2,954 reviews",,[],"['Introduction to the Course, and Einstein in Context', 'Events, Clocks, and Reference Frames', 'Ethereal Problems and Solutions', 'The Weirdness Begins', 'Spacetime Switches', 'Breaking the Spacetime Speed Limit', 'Paradoxes to Ponder', 'To the Center of the Galaxy and Back']",['Larry Randles Lagerstrom'],['Stanford University'],Physical Science and Engineering,https://www.coursera.org/learn/einstein-relativity
Introduction to Embedded Systems Software and Development Environments,4.5,Intermediate level,Approx. 9 hours to complete,Flexible schedule,597 reviews,Classify the parts of an embedded systems developer’s Source Configuration Management (SCM)Implement a build system using GNU’s Make and GCC compiler toolsetsWrite C-programs to define data in different memory regions,"['Makefile', 'C Programming', 'Embedded C']","['Embedded System Development Components', 'Compilation with GCC and GNU Make', 'Memory Types, Segments and Management', 'Course 1 Final Assessment']",['Alex Fosdick'],['University of Colorado Boulder'],Physical Science and Engineering,https://www.coursera.org/learn/introduction-embedded-systems
Digital Manufacturing & Design Technology  Specialization,4.6,Beginner level,4 months at 10 hours a week,Flexible schedule,"3,659 reviews",,"['Artificial Intelligence (AI)', 'Digital Design', 'Manufacturing Engineer', 'Industry 4.0']","['Digital Manufacturing & Design', 'Digital Thread: Components', 'Digital Thread: Implementation', 'Advanced Manufacturing Process Analysis', 'Intelligent Machining', 'Advanced Manufacturing Enterprise', 'Cyber Security in Manufacturing  ', 'MBSE: Model-Based Systems Engineering ', 'Roadmap to Success in Digital Manufacturing & Design ']","['Ken English', 'Sara Behdad', 'Shambhu Upadhyaya', 'Rahul Rai', 'Amy Moore']","['The State University of New York', 'University at Buffalo']",Physical Science and Engineering,https://www.coursera.org/specializations/digital-manufacturing-design-technology
"Modern Robotics:  Mechanics, Planning, and Control Specialization",4.8,Intermediate level,4 months at 10 hours a week,Flexible schedule,901 reviews,,[],"['Modern Robotics, Course 1:  Foundations of Robot Motion', 'Modern Robotics, Course 2:  Robot Kinematics', 'Modern Robotics, Course 3:  Robot Dynamics', 'Modern Robotics, Course 4:  Robot Motion Planning and Control', 'Modern Robotics, Course 5:  Robot Manipulation and Wheeled Mobile Robots ', 'Modern Robotics, Course 6:  Capstone Project, Mobile Manipulation']",['Kevin Lynch'],['Northwestern University'],Physical Science and Engineering,https://www.coursera.org/specializations/modernrobotics
Plant Bioinformatic Methods Specialization,4.8,Beginner level,2 months at 10 hours a week,Flexible schedule,721 reviews,,"['Genetic Analysis', 'Bioinformatics Analysis', 'Evolution', 'Comparative Genomics']","['Bioinformatic Methods I', 'Bioinformatic Methods II', 'Plant Bioinformatics', 'Plant Bioinformatics Capstone']",['Nicholas James Provart'],['University of Toronto'],Physical Science and Engineering,https://www.coursera.org/specializations/plant-bioinformatic-methods
Semiconductor Packaging Specialization,4.6,Beginner level,1 months at 10 hours a week,Flexible schedule,30 reviews,Examine fundamental concepts and terms used in the Semiconductor Packaging industry.Explore various disciplines utilized in Semiconductor Packaging technologies.Anticipate future challenges associated with Semiconductor Packaging.Identify career opportunities in the field of Semiconductor Packaging. ,"['Quality control in semiconductor packaging', 'Materials selection and testing', 'Semiconductor applications', 'Manufacturing techniques for semiconductor packaging', 'Future trends and innovation in semiconductor packaging', 'Semiconductor packaging design']","['Introduction to Semiconductor Packaging', 'Semiconductor Packaging Manufacturing ', 'Advanced Semiconductor Packaging']",['Terry Alford'],['Arizona State University'],Physical Science and Engineering,https://www.coursera.org/specializations/semiconductor-packaging
Marine Biology,4.8,Beginner level,Approx. 6 hours to complete,Flexible schedule,111 reviews,,[],"['How have organisms adapted to living in the ocean?', 'What are the physical properties of the marine environment and how do they affect life?', 'How do species interact in the ocean?', 'Giants of the Sea: How did Blue Whales Get So Big? (A Case Study)', 'How are Marine Ecosystems Important?']",['John Sparks'],['American Museum of Natural History'],Physical Science and Engineering,https://www.coursera.org/learn/marine-biology
Real-Time Embedded Systems Specialization,3.9,Intermediate level,5 months at 10 hours a week,Flexible schedule,54 reviews,"Rate Monotonic theory and policiesMethods of Rate Monontoic analysisReal-time system design techniquesEngineering principles for allocating functionality and services to hardware, firmware or software implementation","['Fault Tolerance', 'Rate Monotonic Analysis', 'Real-Time Operating System (RTOS)', 'Linux On Embedded Systems', 'Asymmetric Multi-core Processing']","['Real-Time Embedded Systems Concepts and Practices', 'Real-Time Embedded Systems Theory and Analysis', 'Real-Time Mission-Critical Systems Design', 'Real-Time Project for Embedded Systems']",['Sam Siewert '],['University of Colorado Boulder'],Physical Science and Engineering,https://www.coursera.org/specializations/real-time-embedded-systems
Introduction to Sustainability,4.8,,Approx. 25 hours to complete,Flexible schedule,"2,542 reviews",,[],"['Orientation and Introduction', 'Population', 'Ecosystems and Climate Change', 'Energy', 'Water and Agriculture', 'Environmental Policy', 'Measuring Sustainability', 'Conclusion']",['Dr. Jonathan Tomkin'],['University of Illinois at Urbana-Champaign'],Physical Science and Engineering,https://www.coursera.org/learn/sustainability
Astronomy: Exploring Time and Space,4.8,Beginner level,Approx. 43 hours to complete,Flexible schedule,"3,571 reviews",,"['Solar Systems', 'Chemistry', 'Theory Of Relativity', 'Astrobiology']","['Astronomy: Exploring Time and Space', 'Science and History', 'The Night Sky', 'The Tools of Astronomy', 'Matter and Radiation', 'The Solar System', 'Exoplanets', 'Star Birth and Death', 'Galaxies', 'Cosmology', 'Life in the Universe']",['Chris Impey'],['University of Arizona'],Physical Science and Engineering,https://www.coursera.org/learn/astro
Introduction to Systems Engineering,4.7,,Approx. 22 hours to complete,Flexible schedule,742 reviews,,[],"['Course Welcome & Module 1 (Introduction to Systems and System Life Cycle)', 'Systems Engineering and its Relevance and Benefits', 'Needs and Requirements', 'Requirements Elicitation and Elaboration', 'Conceptual Design', 'Preliminary and Detailed Design', 'Construction, Production, and Utilisation', 'Systems Engineering Management', 'Final Exam and Information About Further Study']","['Dr Ian  Faulconbridge ', 'Dr Mike Ryan']",['UNSW Sydney (The University of New South Wales)'],Physical Science and Engineering,https://www.coursera.org/learn/systems-engineering
Solar Energy Basics,4.8,Beginner level,Approx. 15 hours to complete,Flexible schedule,"2,385 reviews",Calculate the energy usage at a locationDesign a basic photovoltaic system to meet a specific energy need at a specific locationDescribe financial models and trends in the photovoltaic energy field,"['Energy Audits', 'Renewable Energy', 'Solar Energy', 'Power & energy calculations', 'Electronic Circuits']","['Introduction to solar power systems', 'Determining energy needs and sizing a PV system', 'The growth of photovoltaic markets', 'Infrastructure of Photovoltaics', 'Basics of Solar Power Capstone']",['Neal Abrams'],['The State University of New York'],Physical Science and Engineering,https://www.coursera.org/learn/solar-energy-basics
