Course Title,Rating,Level,Duration,Schedule,Review,What you will learn,Skill gain,Modules,Instructor,Offered By,Keyword,Course Url
Information Technology (IT) Fundamentals for Everyone,4.6,Beginner level,18 hours (approximately),Flexible schedule,60 reviews,"Define operating systems, computer components, programming concepts, databases, and explain the differences between commercial and open software  Summarize the importance of computer networks, including wired and wireless connections; explore network resources and storage types in MS Windows  Describe how to protect against security threats, address public browsing security concerns, and list password management best practices  List the benefits of cloud computing, describe the cloud infrastructure layer, virtual machines, and summarize features of ticketing systems","['Project Management', 'Information Technology', 'Cloud Computing', 'security', 'Operating Systems']","['Introduction to Hardware and Operating Systems', 'Introduction to Software, Programming, and Databases', 'Introduction to Networking and Storage', 'Introduction to Cybersecurity Essentials', 'Introduction to Cloud Computing', 'Final Assessment and (Bonus) IT Support and Operations']",['IBM Skills Network Team'],['IBM'],Information Technology,https://www.coursera.org/learn/information-technology-it-fundamentals-for-everyone
Google IT Support Professional Certificate,4.8,Beginner level,6 months at 10 hours a week,Flexible schedule,"170,527 reviews","Gain skills required to succeed in an entry-level IT jobLearn to perform day-to-day IT support tasks including computer assembly, wireless networking, installing programs, and customer serviceLearn how to provide end-to-end customer support, ranging from identifying problems to troubleshooting and debuggingLearn to use systems including Linux, Domain Name Systems, Command-Line Interface, and Binary Code","['Customer Service', 'Network Protocols', 'Cloud Computing', 'Encryption Algorithms and Techniques', 'Debugging']","['Technical Support Fundamentals', 'The Bits and Bytes of Computer Networking', 'Operating Systems and You: Becoming a Power User', ' System Administration and IT Infrastructure Services', ' IT Security: Defense against the digital dark arts ']",['Google Career Certificates'],['Google'],Information Technology,https://www.coursera.org/professional-certificates/google-it-support
 System Administration and IT Infrastructure Services,4.7,Beginner level,26 hours (approximately),Flexible schedule,"24,044 reviews",,"['Directory Service', 'Lightweight Directory Access Protocol (LDAP)', 'Backup']","['What is System Administration?', 'Network and Infrastructure Services', 'Software and Platform Services', 'Directory Services', 'Data Recovery & Backups', 'Final Project']",['Google Career Certificates'],['Google'],Information Technology,https://www.coursera.org/learn/system-administration-it-infrastructure-services
IBM IT Support  Professional Certificate,4.8,Beginner level,3 months at 10 hours a week,Flexible schedule,"1,315 reviews","Master the most up-to-date practical skills and tools used by IT support professionals and how to apply them in an everyday professional settingLearn hardware and software skills that help users select, install, and configure their devices, operations systems, and applicationsDevelop a strong IT foundation in topics including cybersecurity, networking, cloud, databases, and be prepared for CompTIA certification examsPractice customer service and troubleshooting skills by using ticketing systems, hands-on labs, demos, and interactive exercises","['Customer Service', 'Technical Support', 'Cloud', 'Troubleshooting', 'IT Fundamentals', 'Software Application Development', 'Computer Programming', 'Software Development Process', 'Database basics', 'Wireless Networks', 'Network Troubleshooting', 'Network Architecture', 'Cloud Storage', 'Networking Hardware', 'Cybersecurity', 'Cryptography', 'Cyberattacks', 'Information Security (INFOSEC)', 'Application Security', 'Cloud Computing', 'Hybrid Multicloud', 'Devops', 'Iaas PaaS Saas', 'Cloud Native', 'Operating Systems', 'hardware', 'Information Technology (IT) Support', 'Ticketing Systems', 'Service Level Agreements (SLA)', 'Certification Test', 'CompTIA ITF+', 'Exam Practice']","['Introduction to Technical Support ', 'Introduction to Hardware and Operating Systems', 'Introduction to Software, Programming, and Databases ', 'Introduction to Networking and Storage', 'Introduction to Cybersecurity Essentials', 'Introduction to Cloud Computing', 'Practice Exam for CompTIA ITF+ Certification', 'Technical Support (IT) Case Studies and Capstone', 'Tech Support Career Guide and Interview Preparation']","['Roopa Raghavan', 'IBM Skills Network Team', 'Rav Ahuja', 'Amy Norton']",['IBM'],Information Technology,https://www.coursera.org/professional-certificates/ibm-technical-support
Information​ ​Systems Specialization,4.8,Beginner level,1 months at 10 hours a week,Flexible schedule,"1,209 reviews",Utilize conceptual frameworks to align IT investments with business strategySpecify business requirements as information system specificationsAssess the fit between business requirements and enterprise systems featuresEvaluate technological alternatives for developing the IT infrastructure for the organization,"['Project Management', 'Critical Thinking', 'Management']","['IS/IT Governance', 'Analysis for Business Systems', 'Enterprise Systems', 'IT Infrastructure and Emerging Trends']","['Jason Chan', 'Soumya Sen', 'Ken Reily', 'Gautam Ray']",['University of Minnesota'],Information Technology,https://www.coursera.org/specializations/information-systems
Information Technology (IT) and Cloud Fundamentals Specialization,4.8,Beginner level,2 months at 10 hours a week,Flexible schedule,388 reviews,"Operating systems history, installation, configuration, and hardware connectors and peripheral identification and troubleshooting techniques.Software management, cloud computing characteristics, benefits and trends, web browser essentials, software development basics, and database basics.Commonly used storage and network types, common security risks, and secure browsing practices.Application of technical and troubleshooting skills for an IT customer support role.","['Software Application Development', 'Computer Programming', 'Software Development Process', 'Database basics', 'IT Fundamentals', 'Technical Support', 'Operating Systems', 'Troubleshooting', 'hardware', 'Cybersecurity', 'Cryptography', 'Cyberattacks', 'Information Security (INFOSEC)', 'Application Security', 'Cloud Computing', 'Hybrid Multicloud', 'Devops', 'Iaas PaaS Saas', 'Cloud Native', 'Certification Test', 'CompTIA ITF+', 'Cloud', 'Exam Practice', 'Wireless Networks', 'Network Troubleshooting', 'Network Architecture', 'Cloud Storage', 'Networking Hardware']","['Introduction to Hardware and Operating Systems', 'Introduction to Software, Programming, and Databases ', 'Introduction to Cloud Computing', 'Introduction to Networking and Storage', 'Introduction to Cybersecurity Essentials', 'Practice Exam for CompTIA ITF+ Certification']","['Roopa Raghavan', 'IBM Skills Network Team', 'Rav Ahuja']",['IBM'],Information Technology,https://www.coursera.org/specializations/it-cloud-fundamentals
Technical Support Fundamentals,4.8,Beginner level,28 hours (approximately),Flexible schedule,"147,559 reviews",,"['Binary Code', 'Customer Support', 'Linux', 'Troubleshooting']","['Introduction to IT ', 'Hardware', 'Operating System', 'Networking', 'Software', 'Troubleshooting']",['Google Career Certificates'],['Google'],Information Technology,https://www.coursera.org/learn/technical-support-fundamentals
Computer Hardware and Software,4.4,Beginner level,11 hours (approximately),Flexible schedule,111 reviews,Identify the basic hardware components of a computer. Explain how software creates a functional and productive computer. Build a basic computer.,"['Building Computers', 'Computer Software', 'Computer Hardware']","['Hardware', 'Software', 'Networking and the Internet']",['Tim Carrington'],"['University of California, Irvine']",Information Technology,https://www.coursera.org/learn/computer-hardware-software
Introduction to Information Technology and AWS Cloud,4.8,Beginner level,6 hours (approximately),Flexible schedule,87 reviews,Gain a foundational understanding of how computers workLearn how computers talk to each other to exchange data,"['Cloud Computing Security', 'Project Management', 'Data Analysis', 'Information Technology', 'Cloud Computing']","['Module 1: Foundational IT Knowledge', 'Week 2: IT and the Internet', 'Week 3: The AWS Cloud']","['Morgan Willis', 'Rafael Lopes']",['Amazon Web Services'],Information Technology,https://www.coursera.org/learn/information-technology-and-aws
Crash Course on Python,4.8,Beginner level,39 hours (approximately),Flexible schedule,"35,221 reviews","Understand what Python is and why Python is relevant to automationWrite short Python scripts to perform automated actionsUnderstand how to use the basic Python structures: strings, lists, and dictionariesCreate your own Python objects","['Python Programming', 'Basic Python Syntax', 'Basic Python Data Structures', 'Object-Oriented Programming (OOP)', 'Fundamental Programming Concepts']","['Hello Python!', 'Basic Python Syntax', 'Loops', 'Strings, Lists and Dictionaries', 'Final Project']",['Google Career Certificates'],['Google'],Information Technology,https://www.coursera.org/learn/python-crash-course
IBM Cybersecurity Analyst Professional Certificate,4.6,Beginner level,4 months at 10 hours a week,Flexible schedule,"11,183 reviews",Develop knowledge of cybersecurity analyst tools including data protection; endpoint protection; SIEM; and systems and network fundamentals.   Learn about key compliance and threat intelligence topics important in today’s cybersecurity landscape. Gain skills for incident responses and forensics with real-world cybersecurity case studies.Get hands-on experience to develop skills via industry specific and open source Security tools.,"['information security analyst', 'Junior cybersecurity analyst', 'IT security analyst', 'security analyst']","['Introduction to Cybersecurity Tools & Cyber Attacks', 'Cybersecurity Roles, Processes & Operating System Security', 'Cybersecurity Compliance Framework & System Administration', 'Network Security & Database Vulnerabilities ', 'Penetration Testing, Incident Response and Forensics', 'Cyber Threat Intelligence', 'Cybersecurity Capstone:  Breach Response Case Studies', 'IBM Cybersecurity Analyst Assessment ']",['IBM Skills Network Team'],['IBM'],Information Technology,https://www.coursera.org/professional-certificates/ibm-cybersecurity-analyst
IBM Full Stack Software Developer Professional Certificate,4.5,Beginner level,4 months at 10 hours a week,Flexible schedule,"5,163 reviews","Master the most up-to-date practical skills and tools that full stack developers use in their daily rolesLearn how to deploy and scale applications using Cloud Native methodologies and tools such as Containers, Kubernetes, Microservices, and ServerlessDevelop software with front-end development languages and tools such as HTML, CSS, JavaScript, React, and BootstrapBuild your GitHub portfolio by applying your skills to multiple labs and hands-on projects, including a capstone","['Git (Software)', 'Cloud Applications', 'HTML', 'Cloud Computing', 'Distributed Version Control (DRCS)', 'open source', 'JavaScript', 'Hybrid Multicloud', 'Devops', 'Cascading Style Sheets (CSS)', 'Iaas PaaS Saas', 'Cloud Native']","['Introduction to Cloud Computing', 'Introduction to Web Development with HTML, CSS, JavaScript', 'Getting Started with Git and GitHub', 'Developing Front-End Apps with React', 'Developing Back-End Apps with Node.js and Express', 'Python for Data Science, AI & Development', 'Developing AI Applications with Python and Flask', 'Django Application Development with SQL and Databases', 'Introduction to Containers w/ Docker, Kubernetes & OpenShift', 'Application Development using Microservices and Serverless ', 'Full Stack Cloud Development Capstone Project', 'Full Stack Software Developer Assessment']","['Michelle Saltoun', 'Alex Parker', 'IBM Skills Network Team', 'Abhishek Gagneja', 'Yan Luo', 'Joseph Santarcangelo', 'Rav Ahuja', 'Upkar Lidder', 'Sachin Jambur', 'Lavanya Thiruvali Sunderarajan', 'Ramesh Sannareddy']",['IBM'],Information Technology,https://www.coursera.org/professional-certificates/ibm-full-stack-cloud-developer
Cybersecurity for Everyone,4.7,Beginner level,Approx. 21 hours to complete,Flexible schedule,"1,313 reviews",,[],"['Cybersecurity for Everyone:  Defining Cyber, Security, and Cybersecurity Policy (Week 1)', 'Cybersecurity for Everyone: Evolution of the Internet (Week 2)', 'Cybersecurity for Everyone: Global Telecommunications Architecture and Governance (Week 3)', 'Cybersecurity for Everyone: Threat Actors and Their Motivations (Week 4)', 'Cybersecurity for Everyone: The Hacking Process (Week 5)', 'Cybersecurity for Everyone: End Effects - Direct and Indirect Consequences (Week 6)']",['Charles Harry'],"['University of Maryland, College Park']",Information Technology,https://www.coursera.org/learn/cybersecurity-for-everyone
Introduction to Networking and Storage,4.7,Beginner level,12 hours (approximately),Flexible schedule,319 reviews,"Identify wired and wireless network types, explain physical and logical topology, differentiate network cable types and what each is used for. List common network devices. Discover what packets are and how IP addresses work, and explain what protocols are and why models are necessary.Determine how to set up and encrypt networks and mobile devices. Diagnose connectivity issues and utilize the command prompt and Windows Settings.List network drive types, explain RAM, ROM, and RAID, and troubleshoot storage issues. Explain STaaS, and define file, block, and object storage. ","['Wireless Networks', 'Network Troubleshooting', 'Network Architecture', 'Cloud Storage', 'Networking Hardware']","['Networking Fundamentals\u202f', 'Networking Fundamentals Part II', 'Configuring and Troubleshooting Networks', 'Storage Types and Network Sharing\u202f', 'Final Quiz and Assignment']",['IBM Skills Network Team'],['IBM'],Information Technology,https://www.coursera.org/learn/introduction-to-networking-and-storage
Cybersecurity Operations Fundamentals Specialization,4.8,Beginner level,3 months at 2 hours a week,Flexible schedule,166 reviews,"The concepts behind TCP/IP networking communicationThe basics of networking communication, common attack vectors, and malicious activitiesThe patterns of suspicious behaviors typically encountered when working in a Security Operations Center (SOC)","['Cybersecurity', 'Network Security', 'Information Security (INFOSEC)', 'Security Operations Center (SOC)', 'Cyber']","['Security Operations Center (SOC)', 'Endpoints and Systems', 'Network Security', 'Data Security', 'Threat Analysis', 'Threat Investigation', 'Threat Response']",['Cisco Learning & Certifications'],['Cisco Learning and Certifications'],Information Technology,https://www.coursera.org/specializations/cbrops
"Information Systems Auditing, Controls and Assurance",4.7,Beginner level,Approx. 8 hours to complete,Flexible schedule,"3,262 reviews",,"['Information Technology (IT) Management', 'Risk Management', 'Change Management', 'Information Security (INFOSEC)', 'Audit']","['Introduction to Information Systems (IS) Auditing', 'Perform IS auditing', 'Business Application Development and the Roles of IS Auditors', 'IS Maintenance and Control']",['Garvin Percy DIAS'],['The Hong Kong University of Science and Technology'],Information Technology,https://www.coursera.org/learn/information-systems-audit
Google IT Automation with Python Professional Certificate,4.8,Beginner level,6 months at 10 hours a week,Flexible schedule,"35,825 reviews","Automate tasks by writing Python scriptsUse Git and GitHub for version controlManage IT resources at scale, both for physical machines and virtual machines in the cloud Analyze real-world IT problems and implement the appropriate strategies to solve those problems","['Configuration Management', 'Python Programming', 'Using Version Control', 'Troubleshooting & Debugging', 'Automation']","['Crash Course on Python', 'Using Python to Interact with the Operating System', 'Introduction to Git and GitHub', 'Troubleshooting and Debugging Techniques', 'Configuration Management and the Cloud', 'Automating Real-World Tasks with Python']",['Google Career Certificates'],['Google'],Information Technology,https://www.coursera.org/professional-certificates/google-it-automation
Computer and Peripheral Hardware,4.6,Beginner level,Approx. 25 hours to complete,Flexible schedule,14 reviews,"Identify basic cable types and their connectors, features, and purposes.Explain and configure motherboards, central processing units (CPUs), and add-on cards.Demonstrate knowledge of several types of memory and their installation.",[],"['Module 1: Motherboards/Ports and Cables', 'Module 2: CPU and Power Supply', 'Module 3: Computer Storage', 'Summative Course Assessment ']",['Kevin Vaccaro'],['Illinois Tech'],Information Technology,https://www.coursera.org/learn/illinois-tech-computer-and-peripheral-hardware
New Technologies for Business Leaders,4.4,Intermediate level,Approx. 18 hours to complete,Flexible schedule,381 reviews,,[],"['INTRODUCTION TO DIGITAL TRANSFORMATION', 'AUGMENTED, VIRTUAL AND MIXED REALITY', 'INTERNET OF THINGS', 'ARTIFICIAL INTELLIGENCE AND BIG DATA', 'Blockchain technology applications and crypto currencies']","['Mark Mueller-Eberstein, Dipl. Kfm.']",['Rutgers the State University of New Jersey'],Information Technology,https://www.coursera.org/learn/new-technologies-business-leaders
Microsoft Cybersecurity Analyst Professional Certificate,4.8,Beginner level,6 months at 10 hours a week,Flexible schedule,804 reviews,"Understand the cybersecurity landscape and learn core concepts foundational to security, compliance, and identity solutions.Understand the vulnerabilities of an organizations network and mitigate attacks on network infrastructures to protect data.Develop and implement threat mitigation strategies by applying effective cybersecurity measures within an Azure environment.   Demonstrate your new skills with a capstone project and prepare for the industry-recognized Microsoft SC-900 Certification exam.   ","['Cloud Computing Security', 'Computer Security Incident Management', 'Network Security', 'Penetration Test', 'Threat mitigation']","['Introduction to Computers and Operating Systems and Security', 'Introduction to Networking and Cloud Computing', 'Cybersecurity Threat Vectors and Mitigation', 'Cybersecurity Identity and Access Solutions using Azure AD', 'Cybersecurity Solutions and Microsoft Defender', 'Cybersecurity Tools and Technologies', 'Cybersecurity Management and Compliance', 'Advanced Cybersecurity Concepts and Capstone Project', 'Microsoft SC-900 Exam Preparation and Practice']",[' Microsoft'],['Microsoft'],Information Technology,https://www.coursera.org/professional-certificates/microsoft-cybersecurity-analyst
MySQL with Information Technology,4.4,Beginner level,1.5 hours,,18 reviews,Recognize the role of MySQL in an information system.Describe the features of MySQL.Create and populate a MySQL database.,"['Mysql Workbench', 'Database (DBMS)', 'Relational Database', 'SQL', 'MySQL']",['Learn step-by-step'],['Judy Richardson'],['Coursera Project Network'],Information Technology,https://www.coursera.org/projects/mysql-information-technology
IBM Data Engineering Professional Certificate,4.6,Beginner level,5 months at 10 hours a week,Flexible schedule,"3,911 reviews","Master the most up-to-date practical skills and knowledge data engineers use in their daily rolesLearn to create, design, & manage relational databases & apply database administration (DBA) concepts to RDBMSs such as MySQL, PostgreSQL, & IBM Db2 Develop working knowledge of NoSQL & Big Data using MongoDB, Cassandra, Cloudant, Hadoop, Apache Spark, Spark SQL, Spark ML, and Spark Streaming Implement ETL & Data Pipelines with Bash, Airflow & Kafka; architect, populate, deploy Data Warehouses; create BI reports & interactive dashboards ","['Data Science', 'Data Analysis', 'Python Programming', 'ETL & Data Pipelines', 'NoSQL and Big Data', 'SQL', 'Apache Spark', 'Database (DBMS)', 'Relational Database Management Systems (RDBMS)']","['Introduction to Data Engineering', 'Python for Data Science, AI & Development', 'Python Project for Data Engineering', 'Introduction to Relational Databases (RDBMS)', 'Databases and SQL for Data Science with Python', 'Hands-on Introduction to Linux Commands and Shell Scripting', 'Relational Database Administration (DBA)', 'ETL and Data Pipelines with Shell, Airflow and Kafka', 'Getting Started with Data Warehousing and BI Analytics', 'Introduction to NoSQL Databases', 'Introduction to Big Data with Spark and Hadoop', 'Machine Learning with Apache Spark', 'Data Engineering Capstone Project']","['Sandip Saha Joy', 'Muhammad Yahya', 'Priya Kapoor', 'Jeff Grossman', 'Steve Ryan', 'IBM Skills Network Team', 'Abhishek Gagneja', 'Yan Luo', 'Hima Vasudevan', 'Joseph Santarcangelo', 'Romeo Kienzler', 'Rav Ahuja', 'Sam Prokopchuk', 'Aije Egwaikhide', 'Ramesh Sannareddy', 'Sabrina Spillner']",['IBM'],Information Technology,https://www.coursera.org/professional-certificates/ibm-data-engineer
Foundations of Software Testing and Validation,4.6,Beginner level,Approx. 5 hours to complete,Flexible schedule,101 reviews,"Describe various types of software testing and identify their advantages and disadvantages.Explain the significance of software testing in the software development process, recognising when and why testing should be employed.Apply knowledge of testing techniques to design effective test cases, evaluate their effectiveness, and generate comprehensive testing plans.Gain digital skills as part of Click Start! Follow the link in the instructor bio to see if you're eligible for FREE access to this course and more..","['Software Testing', 'Software Development', 'Validation']","['Week 1: Foundations of software testing and validation', 'Week 2: Test design techniques and validation ']","['Click Start', 'Julian Brooks']",['University of Leeds'],Information Technology,https://www.coursera.org/learn/foundations-of-software-testing-and-validation
IBM IT Project Manager Professional Certificate,4.8,Beginner level,4 months at 10 hours a week,Flexible schedule,375 reviews,"Master the most up-to-date practical skills and tools IT project managers use in their daily rolesLearn Agile concepts of adaptive planning, iterative development, and continuous improvement leading to early deliveries and high customer valueTrack and manage projects, including addressing difficult client situations and how activities shift throughout the project management lifecycleApply your new skills to real-world projects and hands-on labs","['Project Management', 'Scrum Master', 'Risk Management', 'Communication', 'Information Technology', 'Leadership', 'agile']","['Introduction to Project Management ', 'Project Management Foundations, Initiation, and Planning', 'Project Lifecycle, Information Sharing, and Risk Management', 'Project Management Communication, Stakeholders & Leadership ', 'Information Technology (IT) Fundamentals for Everyone', 'Introduction to Software Engineering', 'Introduction to Scrum Master Profession', 'Introduction to Agile Development and Scrum', 'Project Management Capstone']","['IBM Skills Network Team', 'Daniel C. Yeomans', 'Bethany Hudnutt', 'Rav Ahuja', 'Skill-Up EdTech Team', 'John Rofrano', 'Kasie Kyle']","['IBM', 'SkillUp EdTech']",Information Technology,https://www.coursera.org/professional-certificates/ibm-it-project-manager
Google Cloud Fundamentals: Core Infrastructure,4.7,Beginner level,5 hours (approximately),Flexible schedule,"47,588 reviews",Identify the purpose and value of Google Cloud products and services.Define how infrastructure is organized and controlled in Google CloudExplain how to create a basic infrastructure in Google CloudSelect and use Google Cloud storage options,"['Google Compute Engine', 'Google App Engine (GAE)', 'Google Cloud Platform', 'Cloud Computing']","['Course Introduction', 'Introducing Google Cloud', 'Resources and Access in the Cloud', 'Virtual Machines and Networks in the Cloud', 'Storage in the Cloud', 'Containers in the Cloud', 'Applications in the Cloud', 'Course Summary']",['Google Cloud Training'],['Google Cloud'],Information Technology,https://www.coursera.org/learn/gcp-fundamentals
JavaScript Security Specialization,4.5,Intermediate level,1 months at 10 hours a week,Flexible schedule,58 reviews,XSS and remote code execution. Regular expressions.CSRF and browser security. ,"['Secure Coding', 'Node.Js', 'JavaScript']","['JavaScript Security Refreshers', 'JavaScript Security Part 1', 'JavaScript Security Part 2', 'JavaScript Security Part 3']",['Vladimir de Turckheim'],['Infosec'],Information Technology,https://www.coursera.org/specializations/javascript-security
