Aprendizajes en Ingeniería y Agricultura con Arduino: Construcción y automatización de un invernadero,4.8,Beginner level,Approx. 11 hours to complete,Flexible schedule,37 reviews,"Aprenderás como programar un sistema de riego automatizado y armar paso a paso un invernadero.Los aspectos básicos de electrónica y programación a través del uso de placas Arduino. Aprenderás las diferentes aplicaciones en que se puede usar un sistema de riego automatizado, inclusive para las plantas del hogar.","['Habilidades psicomotrices y creativas.', 'Cuidado del medio ambiente.', 'Diseño e instalación de sistemas de riego automatizado.', 'Aspectos básicos de electrónica y programación a través del uso de placas Arduino.', 'Resolución de problemas y seguir instrucciones.']","['Introducción', 'Tipos de estructuras y elementos necesarios para la puesta en funcionamiento de un sistema de riego automático.', 'Programación del invernadero.', 'Conexiones y aplicaciones.']","['Julio Cesar Garcia Alvarez', 'Cristian David Dallos Loaiza', 'Paola Carmona Castañeda']",['Universidad Nacional de Colombia'],Physical Science and Engineering,https://www.coursera.org/learn/aprendizajes-en-ingeniera-y-agricultura
Automating Image Processing,,Beginner level,13 hours (approximately),Flexible schedule,,"Apply image processing algorithms to large sets of images & verify your algorithms generalize to new imagesApply image processing algorithms to video filesAnalyze your image & video processing results, including calculating statistics like average area & identifying outliersComplete a specialization-level project where you will detect cars in a noisy video","['Image Processing', 'Object Detection', 'Matlab', 'video processing']","['Processing Batches of Images', 'Working with Video Files', 'Analyzing Results', 'Final Project: Detecting Cars in a Noisy Video']","['Sam Jones', 'Isaac Bruss', 'Amanda  Wang', 'Matt Rich', 'Megan Thompson', 'Brandon Armstrong']",['MathWorks'],Physical Science and Engineering,https://www.coursera.org/learn/automating-image-processing
Cómo autoconstruir tu vivienda. Segunda etapa,4.9,Beginner level,Approx. 15 hours to complete,Flexible schedule,261 reviews,,[],"['Losas de concreto', 'Instalación eléctrica', 'Instalaciones hidrosanitarias']","['Dr. Enrique César Valdez ', 'Ing. Ernesto René Mendoza Sánchez', 'Ing. Francisco López Rivas', 'M. en I. Héctor Guzmán Olguín']",['Universidad Nacional Autónoma de México'],Physical Science and Engineering,https://www.coursera.org/learn/como-autoconstruir-tu-vivienda-segunda-etapa
Conceptos y Herramientas para la Física Universitaria,4.6,,Approx. 18 hours to complete,Flexible schedule,406 reviews,,[],"['Introducción al movimiento', 'Velocidad instantánea y derivadas', 'Teorema del valor promedio e integrales', 'Interpretación de gráficas', 'Introducción a vectores', 'Vectores en el plano cartesiano', 'Vectores en el espacio', 'Producto punto', 'Producto cruz']","['Dr. Genaro Zavala Enríquez', 'Ing. Rodolfo Fernández de Lara Hadad', 'Ing. José Rodrigo  Salmón Folgueras']",['Tecnológico de Monterrey'],Physical Science and Engineering,https://www.coursera.org/learn/fisica-universitaria
Zn and Ni Based Batteries,,Beginner level,7 hours (approximately),Flexible schedule,," Participants will learn active materials, chemistry and manufacturing processes in various Zn and Ni battery selection and size applications. ","['battery management systems', 'battery charging', 'Electric Vehicles', 'battery types']","['Course Introduction', 'Introduction to Zn-based Batteries', 'Module 2: Ni-based Batteries', 'Module 3: Pb-Acid Batteries']",['Arunachala Nadar Mada Kannan'],['Arizona State University'],Physical Science and Engineering,https://www.coursera.org/learn/zn-and-ni-based-batteries
Digitalisation in Space Research,4.7,Intermediate level,12 hours (approximately),Flexible schedule,86 reviews,"You will learn about a range of digital applications used in space research.You will take a look at hazards created by digitalisation, especially in space travel, and at the challenges faced by the scientific community.You will understand the effects of digitalisation on satellite navigation technology in particular.",[],"['Digital Transformation in the Space Industry', 'Space and Digitisation - Changing Paradigms and Challenges', 'Global Navigation Satellite Systems (GNSS) for efficient and flexible air navigation', 'Digitisation in Earth Observation']","['Guenter W. Hein', 'Klaus Drechsler']",['Technical University of Munich (TUM)'],Physical Science and Engineering,https://www.coursera.org/learn/space
Introduction to advanced tomography,4.7,,Approx. 30 hours to complete,Flexible schedule,56 reviews,,[],"['Introduction to Advanced Tomography', 'What is tomography and what can it do for me?', 'Introduction to Jupyter notebooks for data handling', 'Where is the data coming from?', 'Description of the cases studied throughout the course', 'Tomographic reconstruction', 'Imaging contrast', 'Segmentation', 'Computer resources', 'Modelling physical parameters', 'Closing session']","['Henning Osholm Soerensen', 'Jakob Sauer Jørgensen', 'Vedrana Andersen Dahl', 'Jens Wenzel Andreasen', 'Lars Pilgaard Mikkelsen']",['Technical University of Denmark (DTU)'],Physical Science and Engineering,https://www.coursera.org/learn/cinemaxe
Introduction to Semiconductor Process 2,,Intermediate level,Approx. 5 hours to complete,Flexible schedule,,,"['Metallization', 'Plasma Technology', 'Nano-Device', 'Electronic Packaging', 'process', 'semiconductor']","['Week 1  Wet Etch', 'Week 2 Plasma & Dry Etch', 'Week 3  Thin Film Deposition 1', 'Week 4 Thin Film Deposition 2', 'Week 5 Metallization, Chemical Mechanical Polishing, Strain Engineering', 'Week 6 Electronic Packaging', 'Week 7 Advanced Packaging 2.5D/3D', 'Week 8 DRAM Process', 'Week 9 3D Transistor Process']",['Keon Jae Lee'],['Korea Advanced Institute of Science and Technology(KAIST)'],Physical Science and Engineering,https://www.coursera.org/learn/semiconductor-process-2
Introduction to Household Water Treatment and Safe Storage,4.8,Intermediate level,Approx. 13 hours to complete,Flexible schedule,"1,000 reviews",,[],"['Introduction to HWTS', 'HWTS treatment options ', 'HWTS treatment options ', 'Implementation strategies for HWTS', 'Monitoring and Evaluating HWTS']","['Sara Marks', 'Rick Johnston']",['École Polytechnique Fédérale de Lausanne'],Physical Science and Engineering,https://www.coursera.org/learn/water-treatment
Fundamentals of Global Energy Business,4.6,,Approx. 20 hours to complete,Flexible schedule,476 reviews,,"['Energy', 'Economics', 'Strategic Analysis', 'Business Analysis', 'Business Analytics']","['Demand for Energy', 'Energy Supplies and Market Allocations', 'Key Capabilities for Energy Business - Fossil Fuels', 'Key Capabilities for Energy Business - Alternative Resources', 'Stakeholders and Political Considerations in the Energy Business', 'Strategic Analysis of Energy Business Opportunities']",['Michael J. Orlando'],['University of Colorado System'],Physical Science and Engineering,https://www.coursera.org/learn/energy-business
Conceptos base para el estudio del medio ambiente,4.7,Beginner level,Approx. 14 hours to complete,Flexible schedule,480 reviews,,[],"['Bases Biológicas para la Gestión Sostenible', 'CONCEPTOS DE QUÍMICA PARA LA GESTIÓN SOSTENIBLE', 'Los fenómenos físicos en el medio ambiente', 'Estadística aplicada a la resolución de problemas en ciencias ambientales']","['Stella Maris Diez ', 'Paula Iturbide', ' María del Pilar Ardanza de Rumi', 'Adriana Alicia Perez', 'Marina Vega']",['Universidad Austral'],Physical Science and Engineering,https://www.coursera.org/learn/conceptos-estudio-del-medio-ambiente
Introducción a los modelos de demanda de transporte,4.7,Intermediate level,Approx. 7 hours to complete,Flexible schedule,433 reviews,,[],"['Introducción a los Modelos de Demanda de Transporte', 'Metodologías de Recolección de Información', 'Modelos de Generación y Atracción de Viajes', 'Modelos Agregados de Elección de Destino y Modo de Viaje', 'Modelos Desagregados de Elección Discreta']","['Sebastián Raveau', 'Juan de Dios Ortuzar', 'Luis Ignacio Rizzi']",['Pontificia Universidad Católica de Chile'],Physical Science and Engineering,https://www.coursera.org/learn/demanda-de-transporte
Controle a Tempo Discreto,,Intermediate level,Approx. 11 hours to complete,Flexible schedule,,,[],"[' Sistemas a tempo discreto, equações a diferenças, Transformada Z de sinais a tempo discreto, função de transferência e estabilidade', 'Amostragem de sistemas a tempo contínuo e equivalentes discretos', 'Controle direto digital: domínio da frequência e plano Z', ' Controle direto digital: espaço de estados']","['Rubens Junqueira Magalhães Afonso', 'Jackson Paul Matsuura']",['Instituto Tecnológico de Aeronáutica'],Physical Science and Engineering,https://www.coursera.org/learn/controle-tempo-discreto
Physics 101 - Energy and Momentum,4.5,Intermediate level,23 hours (approximately),Flexible schedule,20 reviews,Learners will be prepared to critically evaluate real-world data and information regarding energy and motion.Learners can apply mathematical laws to the motions of objects under a variety of physical circumstances.Learners will be prepared for more advanced courses in physics.,"['Mechanical Engineering', 'Problem Solving', 'Physics']","['Energy', 'Momentum and Collisions', 'Statics and Elasticity', 'Energy and Momentum EXAM']",['Jason Hafner'],['Rice University'],Physical Science and Engineering,https://www.coursera.org/learn/physics-101-energy-momentum
Adding Electronics to Rapid Prototypes,,Beginner level,4 hours (approximately),Flexible schedule,,You will learn how to incorporate electronic components in your rapid prototypes.,['Incorporating electronic components'],"['Course Introduction', 'Module 1: Electric Circuit Basics', 'Module 2: Electrical Connections', 'Module 3: Motors', 'Module 4: Microcontrollers']",['Daniel Frank'],['Arizona State University'],Physical Science and Engineering,https://www.coursera.org/learn/adding-electronics-to-rapid-prototypes
大学化学,4.9,,Approx. 42 hours to complete,Flexible schedule,129 reviews,,[],"['绪论', '原子结构', '分子结构', '气体', '分子间作用力', '期中考试', '化学动力学', '化学平衡', '溶液中的平衡', '化学热力学', '电化学', '期末考试']",['Prof. Jiang Bian'],['Peking University'],Physical Science and Engineering,https://www.coursera.org/learn/da-xue-hua-xue
Energy and Environment,4.9,Beginner level,22 hours (approximately),Flexible schedule,14 reviews,,[],"['Module 1: An Overview of Non-renewable Energy', 'Module 2: Fossil Fuel and Future of Energy', 'Module 3: The World of Renewable Energy', 'Module 4: Effects of Global Change']",['Andy Friedland'],['Dartmouth College'],Physical Science and Engineering,https://www.coursera.org/learn/energy-and-environment
"Modern Robotics, Course 2:  Robot Kinematics",4.9,Intermediate level,18 hours (approximately),Flexible schedule,279 reviews,,[],"['Chapter 4: Forward Kinematics', 'Chapter 5: Velocity Kinematics and Statics', 'Chapter 6: Inverse Kinematics', 'Chapter 7: Kinematics of Closed Chains']",['Kevin Lynch'],['Northwestern University'],Physical Science and Engineering,https://www.coursera.org/learn/modernrobotics-course2
Real-Time Project for Embedded Systems,,Advanced level,48 hours (approximately),Flexible schedule,,"Real-time system design concepts and decomposition of functions and indentification of key servicesDe-coupling of I/O from real-time processing to avoid response time over-runsUsing AMP design principles with Rate Monotonic  policy, analysis and theoryUsing AMP design principles with best-effort and parallel real-time co-processing","['Concurrency (Computer Science)', 'rate montonic analysis', 'system debugging', 'real-time tracing', 'real-time design']","['RTES Project Goals and Objectives', 'Completion of RTES Project and Preliminary Functional Testing', 'Timing Analysis — Comparison of Actual to Predicted Service Time Events', 'Methods for System Verification and Validation of RTES project', 'Final Project Review and Presentation']",['Sam Siewert '],['University of Colorado Boulder'],Physical Science and Engineering,https://www.coursera.org/learn/real-time-project-embedded-systems
"Human Health Risks, Health Equity, and Environmental Justice",,Beginner level,17 hours (approximately),Flexible schedule,,"Explore environmental justice.Explore the steps involved in risk assessment, as well as how risk assessment can incorporate and address environmental justice issues.","['Environmental justice', 'Health Equity']","['Week 1: Environmental Justice', 'Week 2: Vulnerable and Susceptible Populations', 'Week 3: Risk Assessment', 'Week 4: Risk Management']",['Richard Neitzel'],['University of Michigan'],Physical Science and Engineering,https://www.coursera.org/learn/human-health-risks-health-equity-and-environmental-justice
Sustainability Challenges for the Planet and Employers,,Beginner level,13 hours (approximately),Flexible schedule,,,"['Business Communication', 'Professional Development', 'Problem Solving', 'Sustainability']","['Introduction to sustainability challenges', 'Planetary challenges', 'What are sustainability indicators?', 'Common sustainability challenges faced by businesses', 'What is waste stream management?', 'What primary green building practices should all analysts be familiar with?']",['Christopher Boone'],['Arizona State University'],Physical Science and Engineering,https://www.coursera.org/learn/sustainability-challenges-for-planet-and-employers
Digitalisation in Aeronautics,4.6,Intermediate level,9 hours (approximately),Flexible schedule,160 reviews,"You will learn about a wide variety of digital applications utilised in aviation research.  You will understand the nearly ubiquitous presence of digitalisation in aviation research today.You will recognise the increasing complexity across all systems, resulting in part from digitalisation.  ",[],"['Digital Strategy of Bavaria', 'Collaborative Aircraft Design', 'Digital Avionics Networks', 'Modeling and Simulation of Aerospace Systems with Modelica', 'Digital Models and their Compression in Structure-Control Interaction Problems']","['Guenter W. Hein', 'Klaus Drechsler']",['Technical University of Munich (TUM)'],Physical Science and Engineering,https://www.coursera.org/learn/aeronautics
Interfacing with the Raspberry Pi,4.7,,11 hours (approximately),Flexible schedule,"1,587 reviews",,"['Python Programming', 'Application Programming Interfaces (API)', 'Internet Of Things (IOT)', 'Raspberry Pi']","['Module 1', 'Module 2', 'Module 3', 'Module 4']",['Ian Harris'],"['University of California, Irvine']",Physical Science and Engineering,https://www.coursera.org/learn/raspberry-pi-interface
Battery Pack Balancing and Power Estimation,4.9,Intermediate level,22 hours (approximately),Flexible schedule,96 reviews,How to design balancers and power-limits estimators for lithium-ion battery packs,['H\u200bow to design balancers and power-limits estimators for lithium-ion battery packs'],"['Passive balancing methods for battery packs ', 'Active balancing methods for battery packs', 'How to find available battery power using a simplified cell model ', 'How to find available battery power using a comprehensive cell model', 'Future Battery-Management-System Algorithms', 'Capstone project']",['Gregory Plett'],"['University of Colorado Boulder', 'University of Colorado System']",Physical Science and Engineering,https://www.coursera.org/learn/battery-pack-balancing-power-estimation
Beer Quality: Foam,,Intermediate level,6 hours (approximately),Flexible schedule,,"Discover the science behind foam, how to measure and assess foam and how to achieve the ideal foam.  ","['Foam physics', 'Foam measurement', 'Foam production', 'Foam chemistry']","['Getting Started & Perceptions and Physics of Foam', 'Chemistry and Measuring of Foam', 'Process Impacts on Foam and Interpreting Foam Problems', 'Gushing and Troubleshooting Foam Scenarios']",['Charles Bamforth'],"['University of California, Davis']",Physical Science and Engineering,https://www.coursera.org/learn/beer-quality-foam
"Battery Comparison, Manufacturing, and Packaging",,Beginner level,7 hours (approximately),Flexible schedule,," Participants will learn components of battery management systems, cell balancing, state of charge and state of health estimation. ","['battery management systems', 'battery charging', 'Electric Vehicles', 'battery types']","['Course Introduction', 'Module 1: Comparison of Batteries', 'Module 2: EV Battery Manufacturing', 'Module 3: EV Battery Packaging ']",['Arunachala Nadar Mada Kannan'],['Arizona State University'],Physical Science and Engineering,https://www.coursera.org/learn/battery-comparison-manufacturing-and-packaging
Generative Design for Industrial Applications,4.8,Intermediate level,28 hours (approximately),Flexible schedule,86 reviews,Describe the reverse engineering design process and workflow in Fusion 360.Summarize the trends that are influencing the design industry.Demonstrate knowledge and skills in more advanced Fusion 360 CAD and generative design skills.,"['Computer-Aided Design (CAD)', 'Mechanical Engineering', 'Autodesk Fusion 360', 'Generative Design', 'Manufacturing Processes']","['Working with an Initial Design', 'Defining a Generative Setup and Reviewing Outcomes', 'Reverse Engineering a Generative Design', 'Reviewing and Refining a Design']",[],['Autodesk'],Physical Science and Engineering,https://www.coursera.org/learn/generative-design-industrial-applications
Autonomous Aerospace Systems,4.6,Beginner level,10 hours (approximately),Flexible schedule,13 reviews,Design and develop efficient driving and navigation solutions for autonomous vehicles,"['Modeling', 'Business Intelligence', 'Mechanical Engineering', 'Simulation', 'Virtual models']","['System Representation of Unmanned Aircraft System (UAS). UAS System Architecture. Simulation Models', 'Principles of guidance models, path management, and path following', 'Integrated Navigation in Autonomous Aircraft Systems. GPS/INS. Dead Reckoning', 'Obstacle detection and tracking for UAS: fundamentals of target tracking systems, detection and tracking for sense and avoid systems', 'Design Models and Open-loop dynamics. Autopilot Design. Lateral-directional autopilot. Longitudinal Autopilot Design. Altitude-control State Machine']","['Giancarmine Fasano', 'Alfredo Renga', 'Domenico Accardo']",['Università di Napoli Federico II'],Physical Science and Engineering,https://www.coursera.org/learn/autonomous-aerospace-systems
 Physics 102  - Magnetic Fields and Faraday's Law,,Intermediate level,25 hours (approximately),Flexible schedule,,,"['Force Fields', 'Problem Solving', 'Physics', 'Electronic Circuits', 'Electrical Engineering']","['Magnetic Fields', 'Sources of B', ""Faraday's Law"", 'Exam']",['Jason Hafner'],['Rice University'],Physical Science and Engineering,https://www.coursera.org/learn/physics-102-magnetic-fields-faradays-law
Materials Science for Advanced Technological Applications Specialization,4.6,Intermediate level,2 months at 10 hours a week,Flexible schedule,41 reviews,"The use of principles of the  Fe-Fe3C  phase diagrams to predict microstructures and properties of carbon steel alloys.  The use of the phase diagram to strengthen alloy steels and be able to predict microstucture during age hardening.  Electrical properties of materials and, how/why semiconductors, insulators, and conductors are classified.  ","['The ability to use semiconductors insulators or conductors for technological applications', 'The ability to use principles of phase diagrams to predict microstructures and properties of carbon steel alloy for technological applications.', 'The ability to utilize strengthening mechanisms in metals for technological applications', 'The ability to use principles of phase diagrams to predict microstructures and properties of carbon steel alloy for technological applications']","['Phase Diagrams', 'Hardening, Polymers, Properties', 'Electrical Properties and Semiconductors', 'Ceramics and Composites']",['Terry Alford'],['Arizona State University'],Physical Science and Engineering,https://www.coursera.org/specializations/materials-science-for-advanced-technological-applications
Financing and Initiating Major Engineering Projects,4.8,Intermediate level,22 hours (approximately),Flexible schedule,225 reviews,Understand major project financing and key financial indicators used in major project financeIdentify the key investors in major projectsExplore different approaches to project contracting and learn how to ensure successful project initiation Understand how to assess an organisation's capabilities ,"['Project Management', 'Finance']","['Financing and initiating major engineering projects', 'Financing, investors and contracting', 'Project initiation and delivery models', 'Delivery capability and alignment', 'Project']",['Dr Giorgio Locatelli'],['University of Leeds'],Physical Science and Engineering,https://www.coursera.org/learn/financing-major-engineering-projects
Natural Gas,4.7,Beginner level,15 hours (approximately),Flexible schedule,"2,264 reviews",,[],"['Exploration of Natural Gas', 'Natural Gas Processing, Transmission & Storage', 'Liquefied Natural Gas, Distribution, & Construction', 'Safety & Customer Service']",['Tom Russo'],"['University at Buffalo', 'The State University of New York']",Physical Science and Engineering,https://www.coursera.org/learn/natural-gas
Energy: The Enterprise,4.7,Beginner level,17 hours (approximately),Flexible schedule,"1,024 reviews",,[],"['Energy Touches Everything', 'Energy Sources', 'Energy & Utility Solutions', 'Adaptation']",['Martin Casstevens'],"['University at Buffalo', 'The State University of New York']",Physical Science and Engineering,https://www.coursera.org/learn/energy-industry-overview
Programming for the Internet of Things Project,4.7,,6 hours (approximately),Flexible schedule,882 reviews,,"['Arduino', 'Python Programming', 'Internet Of Things (IOT)', 'Raspberry Pi']","['Get Started ', 'Capstone Design, Part 1', 'Capstone Design, Part 2', 'Capstone Design, Part 3', 'Capstone Design, Part 4 (OPTIONAL) ', 'Specialization Wrap-Up']",['Ian Harris'],"['University of California, Irvine']",Physical Science and Engineering,https://www.coursera.org/learn/internet-of-things-project
Basics of Electrical Protection System,4.4,Beginner level,12 hours (approximately),Flexible schedule,27 reviews,,"['Protection Schemes', 'Numerical Relays', 'Electrical Protection and Equipments', 'Substation Automation System']","['Overview of Protective Relays', 'Instrumentation Transformers', 'Overcurrent Protection Relays', 'Differential relays and system grounding protective relaying', 'Motor protection']",['Subject Matter Expert'],['L&T EduTech'],Physical Science and Engineering,https://www.coursera.org/learn/basics-of-electrical-protection-system
Engineering of Structures: Tension,4.9,Beginner level,13 hours (approximately),Flexible schedule,32 reviews,Define tension   Recognize the role of ropes and cables in sustaining tension  Identify the definitions of the key glossary terms related to tensionRecognize the role of funicular forms in structures,[],"['Introduction to Tension', 'Angles, Funicular Forms, and Bridges', 'Building a Cable-stayed Bridge']",['Vicki May'],['Dartmouth College'],Physical Science and Engineering,https://www.coursera.org/learn/engineering-of-structures-tension
Material Extrusion,,Intermediate level,7 hours (approximately),Flexible schedule,, Students will identify the two ways in which to 3D print using the material extrusion process.,"['Build preparation', 'Post-processing requirements', 'Machine setup', 'Part Selection for Additive Manufacturing']","['Course Introduction', 'Module 2.1: Fused Deposition Modeling', 'Module 2.2: Composite Extrusion ', 'Module 2.3: Course Project and Wrap-Up']",['Dhruv Bhate'],['Arizona State University'],Physical Science and Engineering,https://www.coursera.org/learn/material-extrusion
"Modern Robotics, Course 4:  Robot Motion Planning and Control",4.9,Intermediate level,31 hours (approximately),Flexible schedule,105 reviews,,[],"['Chapter 10:  Motion Planning (Part 1 of 2)', 'Chapter 10: Motion Planning (Part 2 of 2)', 'Chapter 11: Robot Control (Part 1 of 2)', 'Chapter 11:  Robot Control (Part 2 of 2)']",['Kevin Lynch'],['Northwestern University'],Physical Science and Engineering,https://www.coursera.org/learn/modernrobotics-course4
"Modern Robotics, Course 5:  Robot Manipulation and Wheeled Mobile Robots ",4.7,Intermediate level,35 hours (approximately),Flexible schedule,75 reviews,,[],"['Chapter 12:  Grasping and Manipulation (Part 1 of 2)', 'Chapter 12: Grasping and Manipulation (Part 2 of 2)', 'Chapter 13: Wheeled Mobile Robots (Part 1 of 2)', 'Chapter 13:  Wheeled Mobile Robots (Part 2 of 2)']",['Kevin Lynch'],['Northwestern University'],Physical Science and Engineering,https://www.coursera.org/learn/modernrobotics-course5
