Infrastructure as Code with Terraform,4.8,Beginner level,1 hour ,,20 reviews,"Build, change, and destroy infrastructure with TerraformCreate Resource Dependencies with TerraformProvision infrastructure with Terraform","['Cloud Management', 'Cloud Infrastructure', 'Google Cloud Platform']",[],['Google Cloud Training'],['Google Cloud'],Information Technology,https://www.coursera.org/projects/googlecloud-infrastructure-as-code-with-terraform-jwta0
Beginner's guide to AWS Identity and Access Management (IAM),4.3,Beginner level,2 hours,,12 reviews,"You will get a real time experience of enabling Cross account access, to create an Identity provider and to access AWS account via AWS CLI.","['Cybersecurity', 'aws associate', 'Cloud developers', 'DevOps admin', 'AWS Cloud admin']",['Learn step-by-step'],['Ann Kovattil'],['Coursera Project Network'],Information Technology,https://www.coursera.org/projects/beginners-guide-to-aws-identity-and-access-management
Autonomous Vehicle Engineering Specialization,4.3,Beginner level,3 months at 2 hours a week,Flexible schedule,24 reviews,How to schematize a real systemHow to mathematically model multi-physics systemsHow to analyse experimental measuresHow to build Matlab/Simulink models,"['Business Intelligence', 'Autonomous aerospace systems', 'Virtual models', 'Mechanical systems', 'Schematize a real system', 'Modelling and Simulation']","['A quick tour on Big Data and Business Intelligence', 'Autonomous Aerospace Systems', 'Modelling and simulation of mechanical systems']","['Elio Masciari', 'Domenico Accardo', 'Giancarmine Fasano', 'Alfredo Renga', 'Salvatore Strano', 'Sergio Savino']",['Università di Napoli Federico II'],Information Technology,https://www.coursera.org/specializations/autonomous-vehicle-engineering
A Tour of Google Cloud Hands-on Labs,4.8,Beginner level,,,144 reviews,"Learn about the labs platform, and identify key features of a lab environment, and learn how to access the Cloud Console with specific credentials.Learn about Google Cloud projects, and identify common misconceptions about them. Learn about the API library, and examine its chief features.Learn how to use the Google Cloud Navigation menu to identify types of Google Cloud servicesLearn about primitive roles, and use the Cloud IAM service to inspect actions available to specific users.","['Cloud Platforms', 'Google Cloud Platform', 'Cloud Storage']",[],['Google Cloud Training'],['Google Cloud'],Information Technology,https://www.coursera.org/projects/googlecloud-a-tour-of-google-cloud-hands-on-labs-5s3nf
Machine Learning Operations (MLOps) with Vertex AI: Manage Features,,Intermediate level,Approx. 2 hours to complete,Flexible schedule,,"Containerize ML workflows for reproducibility, reuse, and scalable training and inference on Google CloudEfficiently share, discover, and re-use ML features at scale while conducting reproducible ML experiments with Vertex AI Feature Store",[],"['Welcome to the Machine Learning Operations (MLOps) with Vertex AI: Manage Features', 'Introduction to Vertex AI Feature Store', 'Machine Learning Operations (MLOps) with Vertex AI: Manage Features An in depth look ', 'Summary']",['Google Cloud Training'],['Google Cloud'],Information Technology,https://www.coursera.org/learn/machine-learning-operations-with-vertex-ai-manage-features
Exam Prep CJE: Certified Jenkins Engineer,,Beginner level,Approx. 10 hours to complete,Flexible schedule,,Gain knowledge using Jenkins as a build and integration server    Automation of the project development and deployment using Jenkins.Implementation of Continuous Development as Code best practices  ,"['Jenkins tool', 'CI/CD Pipelines']","['Jenkins: Introduction and Key Concepts', 'Jenkins: Features', 'Jenkins: Building Continuous Delivery (CD) Pipelines', 'Jenkins: Continuous Deployment-as-code']",['Whizlabs Instructor'],['Whizlabs'],Information Technology,https://www.coursera.org/learn/cje-certified-jenkins-engineer
Developing Applications in Python on AWS,4.8,Beginner level,9 hours (approximately),Flexible schedule,20 reviews,Introductory level Python programming and Python packagesExplain the different roles in an organization building software,"['Software Architecture', 'Python Programming', 'Web Development', 'Cloud API', 'Automation']","['Module 1: Welcome to the Course', 'Module 2: Architecture Comparison', 'Module 3: Database', 'Module 4: Messaging Services']","['Russell Sayers', 'Morgan Willis']",['Amazon Web Services'],Information Technology,https://www.coursera.org/learn/developing-applications-in-python-on-aws
Cloud and Wireless Security,4.7,Beginner level,5 hours (approximately),Flexible schedule,27 reviews,,"['Cloud Computing Security', 'Wireless Security']","['Module 1: Operate and Configure Cloud Security', 'Module 2: Cloud Security Considerations', 'Module 3: Secure Wireless Configurations', 'Module 4: Chapter 6 Review']",['(ISC)² Education & Training'],['ISC2'],Information Technology,https://www.coursera.org/learn/sscp-4th-ed-course-6
Networking and Security Architecture with VMware NSX,4.7,Intermediate level,Approx. 20 hours to complete,Flexible schedule,442 reviews,,[],"['Introduction & Networking and Security Architecture with VMware NSX', 'NSX Architecture Components', 'Security Solutions with VMware NSX', 'Application Continuity Solutions (part 1 of 2)', 'Application Continuity Solutions (part 2 of 2)', 'Operations (part 1 of 2)', 'Operations (part 2 of 2)', 'SUPPLEMENTAL MATERIALS']",['Chris McCain'],['VMware'],Information Technology,https://www.coursera.org/learn/networking-security-architecture-vmware-nsx
Epidemics,4.9,Beginner level,Approx. 46 hours to complete,Flexible schedule,219 reviews,,[],"['Theme One: Origins (Epidemics past, present and future)', 'Theme One: Origins (Emergence and ecology of infectious diseases)', 'Theme One: Origins (Medical Detective: Bug hunting in Epidemics)', 'Theme Two: Spread (Infectious disease epidemiology)', 'Theme Two: Spread (Epidemiological triangle)', 'Theme Two: Spread (Infectious disease modeling)', 'Theme Three: Control (Disease surveillance)', 'Theme Three: Control (Non-pharmaceutical intervention (NPI))', 'Theme Three: Control (Vaccination)', 'Theme Four: Communication (Communicating disease risk)']","['Guan Yi (HKU)', 'Thomas Abraham (HKU)', 'Malik Peiris (HKU)', 'Gabriel M. Leung (HKU)', 'Mark Jit (LSHTM)', 'Marc Lipsitch (Harvard)', 'Maria Huachen Zhu (HKU)', 'Joseph T. Wu (HKU)', 'Kwok-Yung Yuen (HKU)', 'Benjamin Cowling (HKU)', 'Tommy Lam (HKU)']",['The University of Hong Kong'],Information Technology,https://www.coursera.org/learn/hkuepidemics
Security Governance & Compliance,4.6,,9 hours (approximately),Flexible schedule,124 reviews,,[],"['Introduction to Cybersecurity', 'Security Governance', 'Legal & Regulatory Compliance', 'Policies, Standards, & Procedures']",['Jacob Horne'],"['University of California, Irvine']",Information Technology,https://www.coursera.org/learn/security-governance-compliance
Data Management with Databricks: Big Data with Delta Lakes,,Intermediate level,2 hours,,,Create Delta Tables in Databricks and write data to them.Transform delta table using Python then query data using SQL to create a dashboard.Use Delta Lake's merge operation and version control to efficiently update Delta Tables. ,"['Delta Lakes', 'SQL', 'Data Management', 'Apache Spark', 'Databricks']",['Learn step-by-step'],['Mohamed Touiti'],['Coursera Project Network'],Information Technology,https://www.coursera.org/projects/data-management-with-databricks-big-data-with-delta-lakes
Google Chrome Security and Extensions for Beginners,,Beginner level,1 hour,,,"Configure pop-ups and redirects and install, manage, and remove browser extensions.Perform a safety check and configure browser using Google Chrome. ","['Google Chrome Settings', 'Google Chrome Pop-ups', 'Google Chrome Security', 'Google Chrome Extensions', 'IT Fundamentals']",['Learn step-by-step'],['IBM Skills Network Team'],['IBM'],Information Technology,https://www.coursera.org/projects/google-chrome-security-and-extensions-for-beginners
Streaming HL7 to FHIR Data with Healthcare API,,Intermediate level,1 hour ,,,"Gain a general understanding of the Cloud Healthcare API and its role in managing healthcare data.Learn how to create Cloud Healthcare API datasets , HL7 and FHIR stores.Import HL7 data and importing into a FHIR data using the Cloud Healthcare API.","['Google Cloud Platform', 'Web Development', 'Web Application']",[],['Google Cloud Training'],['Google Cloud'],Information Technology,https://www.coursera.org/projects/googlecloud-streaming-hl7-to-fhir-data-with-healthcare-api-coktd
Introducción a la Minería de Datos,4.6,Beginner level,Approx. 77 hours to complete,Flexible schedule,"1,227 reviews",,[],"['Reglas de Asociación', 'Algoritmos de Clasificación I', 'Algoritmos de Clasificación II', ' Métricas de Evaluación de Clasificación', 'Algoritmos de Clustering']",['Karim Pichara Baksai'],['Pontificia Universidad Católica de Chile'],Information Technology,https://www.coursera.org/learn/mineria-de-datos-introduccion
Wireshark for Beginners: TCP IP Protocol Fundamentals,,Beginner level,2 hours,,,Use Wireshark to observe the Internet Level of TCP/IP.Use Wireshark to observe the Transport  Level of TCP/IP.Use Wireshark to observe HTTPS Application of TCP/IP protocol.,"['Wireshark Display Filters', 'Hypertext Transfer Protocol Secure (HTTPS)', 'Internet Protocol (IP) Suite', 'Wireshark', 'TCP/IP Analysis']",['Learn step-by-step'],['David Dalsveen'],['Coursera Project Network'],Information Technology,https://www.coursera.org/projects/wireshark-for-beginners-tcp-ip-protocol-fundamentals
Building Batch Data Pipelines on GCP 日本語版,4.4,Intermediate level,17 hours (approximately),Flexible schedule,29 reviews,データ読み込みのさまざまな方法の確認: EL、ELT、ETL について、また何をどのタイミングで使用するかDataproc での Hadoop の実行、Cloud Storage の活用、Dataproc ジョブの最適化Dataflow を使用したデータ処理パイプラインの構築Data Fusion と Cloud Composer を使用したデータ パイプラインの管理,[],"['はじめに', 'バッチデータ パイプラインの構築の概要', 'Dataproc での Spark の実行', 'Dataflow を使用したサーバーレスのデータ処理', 'Cloud Data Fusion と Cloud Composer を使用したデータ パイプラインの管理', 'コースのまとめ']",['Google Cloud Training'],['Google Cloud'],Information Technology,https://www.coursera.org/learn/batch-data-pipelines-gcp-jp
"Smart Analytics, Machine Learning, and AI on GCP 日本語版",4.5,Intermediate level,8 hours (approximately),Flexible schedule,31 reviews,リアルタイムのストリーミング分析のユースケースを理解する。Pub/Sub の非同期のメッセージング サービスを使用して、データイベントを管理する。ストリーミング パイプラインを記述して、必要に応じて変換を実行する。ストリーミング パイプラインの両側（生成と利用）について理解する。リアルタイムのストリーミングおよび分析で、Dataflow、BigQuery、Pub/Sub を相互運用する。,[],"['はじめに', '分析と AI の概要', '非構造化データ用の事前構築済み ML モデル API  ', 'Notebooks を使用したビッグデータ分析', 'Kubeflow を使用した本番環境の ML パイプライン', 'BigQuery ML で SQL を使用したカスタムモデルの構築', 'AutoML を使用したカスタムモデルの構築', 'Module 7: まとめ']",['Google Cloud Training'],['Google Cloud'],Information Technology,https://www.coursera.org/learn/smart-analytics-machine-learning-ai-gcp-jp
Modernizing Data Lakes and Data Warehouses with GCP 日本語版,4.3,Intermediate level,7 hours (approximately),Flexible schedule,48 reviews,データ パイプラインを構成する 2 つの主要コンポーネントである、データレイクとデータ ウェアハウスの違いを理解する。各ストレージ タイプのユースケースを確認し、Google Cloud で利用可能なデータレイクとデータ ウェアハウスのソリューションについて、技術的な詳細を学習する。データ エンジニアの役割と、効果的なデータパイプラインが事業運営にもたらすメリットについて理解する。クラウド環境でデータ エンジニアリングを行うべき理由を確認する。,[],"['はじめに', 'データ エンジニアリングの概要', 'データレイクの構築', 'データ ウェアハウスの構築', 'まとめ']",['Google Cloud Training'],['Google Cloud'],Information Technology,https://www.coursera.org/learn/data-lakes-data-warehouses-gcp-jp
Building Resilient Streaming Analytics Systems on GCP 日本語版,4.8,Intermediate level,11 hours (approximately),Flexible schedule,18 reviews,リアルタイムのストリーミング分析のユースケースを理解する。Pub/Sub の非同期のメッセージング サービスを使用して、データイベントを管理する。ストリーミング パイプラインを記述して、必要に応じて変換を実行する。リアルタイムのストリーミングおよび分析で、Dataflow、BigQuery、Pub/Sub を相互運用する,[],"['はじめに', 'ストリーミング データの処理に関する概要', 'Pub/Sub を使用したサーバーレス メッセージング', 'Dataflow のストリーミング機能', 'Cloud Bigtable を使用した高スループットのストリーミング', '高度な BigQuery の機能とパフォーマンス', 'コースのまとめ']",['Google Cloud Training'],['Google Cloud'],Information Technology,https://www.coursera.org/learn/streaming-analytics-systems-gcp-jp
Inteligência Artificial para Logística,,Beginner level,Approx. 33 hours to complete,Flexible schedule,,,"['Jornada do Cliente', 'Internet Of Things (IOT)', 'Gestão Logística', 'Planejamento estratégico', 'Inteligencia Artificial']","['Gestão Logística', 'Planejamento Logístico', 'Sistemas Logísticos', 'Inteligência Artificial e Internet das Coisas']",['Aluizio Faria'],['Fundação Instituto de Administração'],Information Technology,https://www.coursera.org/learn/inteligencia-artificial-para-logistica
Innovations in Investment Technology: Artificial Intelligence,4.7,Beginner level,10 hours (approximately),Flexible schedule,329 reviews,Recognize the strengths and weaknesses of human financial advisors and investors.Explain the business model of robo/AI-advisors.Identify the relationship between identifiable firm characteristics and average returns.Build a diversified portfolio based on attitudes toward risk.,"['Artificial Intelligence (AI)', 'robo advising', 'investment technology', 'diversified portfolio', 'investing technology']","['Introduction', 'Robo Advising', 'Stock Selection & Asset Management', 'Big Data']","['Andrew Wu', 'Robert Dittmar']",['University of Michigan'],Information Technology,https://www.coursera.org/learn/invest-tech
Infrastructure Automation with Terraform,,,Approx. 17 hours to complete,Flexible schedule,,,[],"['Introduction to Infrastructure Automation with Terraform', 'Managing Infrastructure', 'Working with Modules and Remote State', 'Advanced Terraform Features', 'Deploying Resources to GCP', 'Deploying Resources to Azure']",['Whizlabs Instructor'],['Whizlabs'],Information Technology,https://www.coursera.org/learn/infrastructure-automation-with-terraform
Google Drive,4.8,Beginner level,2 hours (approximately),Flexible schedule,161 reviews,"Use, manage, organize and share folders and files using My Drive.Create, manage, and share folders and files in a Google shared drive.Search and navigate using Google Drive.Apply templates to work across Google Workspace applications.",[],"['Course Introduction', 'Introduction to Google Drive', 'Share with Google Drive', 'My Drive', 'Shared drives', 'Templates', 'Google Drive tools and options', 'Business challenge']",['Google Cloud Training'],['Google Cloud'],Information Technology,https://www.coursera.org/learn/google-drive
Preparing for your Professional Cloud Architect Journey,4.7,Advanced level,4 hours (approximately),Flexible schedule,"1,333 reviews",List the five domains covered on the Professional Cloud Architect certification exam.Identify gaps in your knowledge and skills for each domain and create a study plan.,[],"['Module 0: Introduction to Professional Cloud Architect Certification', 'Module 1: Designing and Planning a Cloud Solution Architecture', 'Module 2: Managing and Provisioning a Solution Infrastructure', 'Module 3: Designing for Security and Compliance', 'Module 4: Analyzing and Optimizing Technical and Business Processes', 'Module 5: Managing Implementation and Ensuring Solution and Operations Reliability', 'Module 6: Case Study Preparation and Your Next Steps']",['Google Cloud Training'],['Google Cloud'],Information Technology,https://www.coursera.org/learn/preparing-cloud-professional-cloud-architect-exam
Software Defined Networking,4.3,,5 hours (approximately),Flexible schedule,42 reviews,,[],"['Course Overview & Introduction', 'Evolution of Data Center Networks', 'Data Center Network Example', 'DC Networking: Testing, Debugging, and Traffic Evaluation', 'Project ']",['Umakishore Ramchandran'],['Georgia Institute of Technology'],Information Technology,https://www.coursera.org/learn/sdnetworking
"Data Warehouse Concepts, Design, and Data Integration",4.4,,62 hours (approximately),Flexible schedule,"1,033 reviews",,"['Extraction, Transformation And Loading (ETL)', 'Pentaho', 'Data Integration', 'Data Warehouse']","['Data Warehouse Concepts and Architectures', 'Multidimensional Data Representation and Manipulation', 'Data Warehouse Design Practices and Methodologies', 'Data Integration Concepts, Processes, and Techniques ', 'Architectures, Features, and Details of Data Integration Tools']",['Michael Mannino'],['University of Colorado System'],Information Technology,https://www.coursera.org/learn/dwdesign
Additive Manufacturing,4.7,Beginner level,12 hours (approximately),Flexible schedule,62 reviews,Understand the basics of Additive Manufacturing and industrial applicationsLearn about business considerations around implementing Additive Manufacturing,"['Bussiness', '3D printing', 'Manufacturing Ecosystem', 'Additive manufacturing', 'technology']","['What is Additive Manufacturing?', 'Business Context of Additive Manufacturing', 'Future Trend, Course Summary, and Series Conclusion']",['M.S. Krishnan'],['University of Michigan'],Information Technology,https://www.coursera.org/learn/additive-manufacturing-3d-printing
Networking in Google Cloud: Defining and Implementing Networks,4.8,Intermediate level,7 hours (approximately),Flexible schedule,"1,546 reviews","Configure Google VPC networks, subnets, and routers and control administrative access to VPC objects.Route traffic by using DNS traffic steering.Choose among Google Cloud load balancer and proxy options and configure themImplement network connectivity between Google Cloud projects.",[],"['Module 0: Welcome to Networking in Google Cloud: Defining and Implementing Networks\t', 'Google Cloud VPC Networking Fundamentals', 'Controlling Access to VPC Networks', 'Sharing Networks across Projects', 'Load Balancing', 'Course Resources']",['Google Cloud Training'],['Google Cloud'],Information Technology,https://www.coursera.org/learn/networking-gcp-defining-implementing-networks
Advanced Network Security Specialization,,Advanced level,2 months at 10 hours a week,Flexible schedule,,,['Cloud Management'],"['Next-Generation Firewalls and Intrusion Prevention', 'Securing Cloud and Hybrid Networks', 'Advanced Threat Hunting and Incident Response']",['Vinay Kumar'],['LearnQuest'],Information Technology,https://www.coursera.org/specializations/advanced-network-security
Deploying SAP on Google Cloud,4.6,Beginner level,Approx. 4 hours to complete,Flexible schedule,170 reviews,"Describe Google Cloud Services that are important to design robust, performant & resilient infrastructure for running SAP workloads on Google CloudIdentify the guidelines and best practices for SAP deployments on Google CloudDescribe the reference architectures for High Availability for SAP systems in Google Cloud.Deploy an SAP HANA single-host, high-availability cluster",[],"['Welcome to Deploying SAP on Google Cloud', 'Google Cloud Services for SAP Deployments: Part 1', 'Google Cloud Services for SAP Deployments: Part 2', 'Guidelines for SAP Deployments on Google Cloud', 'Architecting SAP on Google Cloud - High Availability', 'Architecting SAP on Google Cloud - Disaster Recovery & Data Management', 'SAP on Bare Metal Solution', 'Course Summary']",['Google Cloud Training'],['Google Cloud'],Information Technology,https://www.coursera.org/learn/deploying-sap-google-cloud
Intro to Operating Systems 1: Virtualization,4.7,Intermediate level,8 hours (approximately),Flexible schedule,99 reviews,"Foundational principles of virtualization within operating systems, particularly with respect to processes and memory management.Expertise in the C language and its significance in operating system design and functionality.","['C Programming', 'Operating Systems', 'Scheduling Algorithms']","['Introduction', 'Processes and Execution', 'Scheduling', 'Memory']",['Patrick Ester'],['Codio'],Information Technology,https://www.coursera.org/learn/codio-intro-to-operating-systems-1-virtualization
Information Visualization: Foundations,4.5,Beginner level,11 hours (approximately),Flexible schedule,208 reviews,,[],"['Introduction to Information Visualization', 'Data Abstraction', 'Fundamental Graphs and Data Transformation', 'Graphical Components and Mapping Strategies']","['Cristian Felix ', 'Enrico Bertini ']",['New York University'],Information Technology,https://www.coursera.org/learn/information-visualization-fundamentals
Data Analytics and Databases on AWS,,Beginner level,9 hours (approximately),Flexible schedule,,Key data types and structuresAWS services for the ETL processHands-on skills for Amazon API Gateway and Amazon QuickSight,"['Extraction, Transformation And Loading (ETL)', 'Data Analysis', 'Database (DBMS)', 'Data Architecture', 'Data Warehouse']","['Module 1: Foundations of Data Analysis', 'Module 2: ETL Pipeline and Database Foundations', 'Module 3: AWS Services for ETL']","['Oksana Hoeckele', 'Rafael Lopes']",['Amazon Web Services'],Information Technology,https://www.coursera.org/learn/data-analytics-and-databases-aws
Introduction to Data Networks and the Internet - Master's,,Beginner level,Approx. 63 hours to complete,Flexible schedule,,,"['Protocol Implementation', 'Network Monitoring and Security', 'Networking communication']","['Module 1: Introduction to Network Concepts', 'Module 2: OSI, TCP, and Network Addressing', 'Module 3: Network Installation and Configuration', 'Module 4: Network Management', 'Module 5: Network Security Concepts', 'Module 6: Network Analysis', 'Module 7: Network Troubleshooting', 'Module 8: Software Defined Networks and the Cloud', 'Course Summative Assessment']",['Philip Matuszak'],['Illinois Tech'],Information Technology,https://www.coursera.org/learn/illinois-tech-introduction-to-data-networks-and-the-internet-mit
Microsoft Azure Relational Databases,4.6,Beginner level,"This project should take approximately two hours to complete including, Videos, Tasks, and Quiz",,20 reviews,"Create an Azure Database for MYSQL Server using the Azure PortalCreate an Azure MySQL Database by connecting to the cloud serviceAdd, Modify and Query Data in Azure MySQL database","['Azure Relational Databases', 'MySQL command line utility', 'Cloud Services', 'Azure Cloud Shell', 'Azure database for MySQL server']",['Learn step-by-step'],['Brendan McKeown'],['Microsoft'],Information Technology,https://www.coursera.org/projects/microsoft-azure-relational-databases
Pivot Tables in Google Sheets,,Intermediate level,,,,"Apply formatting to cells, rows, and columns.Calculate descriptive statistics like AVERAGE, MEDIAN, and MODE.Create a pivot table and reference data by using named ranges.Use collaboration features in Sheets.","['Database (DBMS)', 'Cloud Computing', 'Data Management', 'Pivot Table']",[],['Google Cloud Training'],['Google Cloud'],Information Technology,https://www.coursera.org/projects/googlecloud-pivot-tables-in-google-sheets-vpxws
Cybersecurity Architecture,,Intermediate level,12 hours (approximately),Flexible schedule,,"Describe the five foundational principles of cybersecurity and the Confidentiality, Integrity, and Availability (CIA) triadSummarize the different areas that a cybersecurity architect must adopt to develop a secure enterprise solutionDiscuss the different security domains, including IAM, endpoint security, network security, application security, and data securityDemonstrate your proficiency in recommending methods to improve network security in a given scenario","['Cybersecurity', 'Network Security', 'Data Security', 'Digital Network Architecture', 'Application Security']","['Cybersecurity Architecture Overview', 'Access Management and Endpoint Security', 'Network, Application, and Data Security', 'Detection and Response', 'Final Project, Exam, and Course Wrap-Up']",['Jeff Crume'],['IBM'],Information Technology,https://www.coursera.org/learn/cybersecurity-architecture
