Crystal Structures and Properties of Metals,,Beginner level,24 hours (approximately),Flexible schedule,,"Crystal Structures, Mechanical Properties of Metals, Tensile Testing, and Failures.",['The ability to use Crystal Structures Mechanical Properties of Metals Tensile Testing and Failures for technological applications'],"['Crystal Structures, Mechanical Properties of Metals, Tensile Testing and Failures', 'Module 1: Crystal Structures', 'Module 2: Crystal Structures', 'Module 3: Mechanical Properties', 'Module 4: Mechanical Properties']",['Terry Alford'],['Arizona State University'],Physical Science and Engineering,https://www.coursera.org/learn/crystal-structures-and-properties-of-metals
Safety First: EV Maintenance & Best Practices,,Beginner level,Approx. 1 hour to complete,Flexible schedule,,"Implement crucial safety practices specific to electric vehicles, safeguarding yourself and others.Make informed decisions about your electric vehicle's care and maintenance.Identify principles of electric vehicle charging infrastructure, ensuring hassle-free charging experiences.Diagnose common EV issues and confidently troubleshoot, reducing repair costs and downtime.","['Diagnostics and Troubleshooting', 'Informed Decision-Making', 'Safety Protocols', 'Routine Maintenance', 'Charging Infrastructure Maintenance']",['Safety First: EV Maintenance & Best Practices'],['Prasanth Kumar Palani'],['Coursera Instructor Network'],Physical Science and Engineering,https://www.coursera.org/learn/safety-first-ev-maintenance--best-practices
Planning with Climate Change in Mind,4.9,Beginner level,6 hours (approximately),Flexible schedule,48 reviews,"Navigate the National Climate Assessment as a resource for information about impacts and adaptationDescribe how place and context relate to climate risk and potential mitigation and adaptation choicesIdentify opportunities for communities, governments, and businesses to manage climate risksExplain the challenges and competing interests that make climate change a difficult issue for communities, governments, and businesses to address",[],"['Sectoral Impacts and Adaptation ', 'Regional Impacts and Adaptation ', 'Taking Climate Action']",['Joseph Casola'],['University of Colorado Boulder'],Physical Science and Engineering,https://www.coursera.org/learn/planning-with-climate-change-in-mind
Agroforestry II: Major Systems of the World,,Intermediate level,7 hours (approximately),Flexible schedule,,,"['Biology', 'Forestry', 'Agronomy', 'Ecology', 'Horticulture']","['Course Introduction', 'Agroforestry Systems']","['Jennifer Vogel, Online Programs Coordinator']",['University of Florida'],Physical Science and Engineering,https://www.coursera.org/learn/agroforestry2
"Beauty, Form & Function: An Exploration of Symmetry",,Beginner level,Approx. 15 hours to complete,Flexible schedule,,,[],"['Concepts in Symmetry I', 'Concepts in Symmetry II', 'Concepts in Symmetry III', 'Concepts in Symmetry IV', 'Plane and Space Symmetry I', 'Plane and Space Symmetry II', 'Plane and Space Symmetry III', 'Plane and Space Symmetry IV']","['Tim White', 'Jiang Shuo']","['Nanyang Technological University, Singapore']",Physical Science and Engineering,https://www.coursera.org/learn/symmetry2021
Behind the Scenes: Exploring EV Core Systems,,Beginner level,Approx. 1 hour to complete,Flexible schedule,,"Identify EV components. Virtual teardown: Students dissect a virtual EV to explore its unique components. Learn EV propulsion. EV simulator: Students experiment with battery charge, regenerative braking, and energy management in a virtual EV.Evaluate charging tech. Charging station explorer: Students tour virtual charging stations, comparing technologies and infrastructure.  Analyze EV performance. EV performance challenge: Students use a simulator to test acceleration, range, and efficiency in different scenarios. ","['Vehicle Systems', 'Batteries', 'Electric Vehicles']",['Behind the Scenes: Exploring EV Core Systems'],['Prasanth Kumar Palani'],['Coursera Instructor Network'],Physical Science and Engineering,https://www.coursera.org/learn/behind-the-scenes-exploring-ev-core-systems
Demystifying EV Batteries: Tech & Management,,Beginner level,Approx. 2 hours to complete,Flexible schedule,,"Recognize the foundational concepts and science behind an electric vehicle battery pack, including its layout and key components.Analyze the different battery chemistries and battery sizes according to each electric vehicle application. Illustrate how an intelligent BMS functions to ensure battery pack safety and optimal EV performance. Assess battery pack degradation and remember best practices for maximizing electric vehicle battery lifetime.","['Charging Strategies', 'Performance Analysis', 'Battery Health', 'Battery Technology', 'Degradation Control']",['Demystifying EV Batteries: Tech & Management'],['Prasanth Kumar Palani'],['Coursera Instructor Network'],Physical Science and Engineering,https://www.coursera.org/learn/demystifying-ev-batteries-tech--management
Control automático: La tecnología invisible ,4.7,Beginner level,Approx. 9 hours to complete,Flexible schedule,350 reviews,,[],"['Introducción', 'Control ¿Dónde estás?', '¿Cómo llegamos a esto?', '¡A moverse! La dinámica de las cosas']","['Dr. Paul Rolando Maya Ortiz ', 'Marco Antonio Arteaga Pérez', 'Marcos Ángel González Olvera']",['Universidad Nacional Autónoma de México'],Physical Science and Engineering,https://www.coursera.org/learn/control-automatico
Las estaciones del año y el clima,4.8,,Approx. 8 hours to complete,Flexible schedule,375 reviews,,[],"['Percepción de las estaciones', 'Parámetros orbitales', 'Bases del sistema climático', 'Funcionamiento del sistema climático']","['Alejandro Aguilar Sierra', 'Rene Garduño López']",['Universidad Nacional Autónoma de México'],Physical Science and Engineering,https://www.coursera.org/learn/estaciones-clima
Physics of silicon solar cells,4.2,,Approx. 13 hours to complete,Flexible schedule,63 reviews,,[],"['INTRODUCTION TO SEMICONDUCTOR PHYSICS', 'TRANSPORT PHENOMENA : THE p-n JUNCTION', 'ASYMMETRICAL DEVICES', 'SOLAR CELL OPERATION', 'CRYSTALLINE SEMICONDUCTOR SOLAR CELLS ', 'SILICON HETEROJUNCTIONS']","['Erik Johnson', 'Pr. Bernard Drevillon']",['École Polytechnique'],Physical Science and Engineering,https://www.coursera.org/learn/physics-silicon-solar-cells
Origens da Vida no Contexto Cósmico,4.8,Beginner level,Approx. 6 hours to complete,Flexible schedule,"2,065 reviews",,"['Biology', 'Solar Systems', 'Plant', 'Astrobiology']","['Módulo 1', 'Módulo 2', 'Módulo 3', 'Módulo 4']","['Rodrigo de Souza', 'Douglas Galante', 'Amancio Friaça', 'Elysandra Figueredo Cypriano', 'Amelia dos Santos', 'Augusto Damineli Neto']",['Universidade de São Paulo'],Physical Science and Engineering,https://www.coursera.org/learn/origensdavida
Mobilités et véhicules électriques ,4.7,Beginner level,Approx. 14 hours to complete,Flexible schedule,102 reviews,,[],"['Bienvenue', 'Chapitre 1 - Comprendre les mobilités et leurs évolutions', ""Chapitre 2 - Mobilités électriques et réduction de l'impact environnemental"", 'Chapitre 3 - Analyse économique', 'Chapitre 4 - Mobilités électriques et infrastructures : dimensions techniques et dimensions économiques', ""Chapitre 5 - Les mobilités électriques aujourd'hui"", ""Chapitre 6 - Prospective : Les chemins de l'électrification"", 'Chapitre 7 - Mobilités électriques, mobilités connectées, mobilités autonomes', 'Chapitre 8 - Mobilité électrique pour tous : utopie ou évidence', 'Conclusion']","['Émeric FORTIN', 'Virginie BOUTUEIL']",['École des Ponts ParisTech'],Physical Science and Engineering,https://www.coursera.org/learn/mobilites-vehicules-electriques
"Electrónica Digital Bit a Bit: Fundamentos, Verilog y FPGA",4.6,,Approx. 14 hours to complete,Flexible schedule,50 reviews,Crear circuitos digitales utilizando Verilog.Crear circuitos digitales implementando una FPGA.,[],"['Introducción a los circuitos lógicos', 'Introducción a Verilog', 'Tecnología', 'Implementación optimizada de funciones lógicas', 'Representación numérica y circuitos de aritmética']",['Angel Abusleme'],['Pontificia Universidad Católica de Chile'],Physical Science and Engineering,https://www.coursera.org/learn/electronica-digital-bit-a-bit-fundamentos
Oceanografía: una clave para entender mejor nuestro mundo,4.7,,Approx. 29 hours to complete,Flexible schedule,341 reviews,,[],"['1A. El Mediterráneo: un modelo de océano - Temperatura, salinidad, presión y densidad. ', '1B. El Mediterráneo: un modelo de océano - Masas de agua y circulación', '2. El Océano global', '3A. Oceanografía per satélite: Todos los ojos sobre el planeta', '3B. Oceanografía por satélite: Todos los ojos sobre el planeta ', '4. Química oceánica: una industria química con tuberías sin paredes.', '5. Las cuencas oceánicas: una memoria continua de millones de años.']","['Jordi Salat', 'Jordi Serra ']","['Universitat de Barcelona', 'Fundació Navegació Oceànica Barcelona']",Physical Science and Engineering,https://www.coursera.org/learn/oceanografia
Introduction to Advanced Vibrations,4.8,Intermediate level,Approx. 13 hours to complete,Flexible schedule,65 reviews,,[],"['Introduction', 'Vibrations of Linear Multiple-degree-of-freedom System 1: Equations of motion, the stiffness and flexibility methods', 'Vibrations of Linear Multiple-degree-of-freedom Systems 2: Modal analysis', 'Vibrations of Continuous Systems 1: The vibration of string', 'Vibrations of Continuous Systems 2: The vibration of beam', 'Project']",['Yang-Hann Kim'],['Korea Advanced Institute of Science and Technology(KAIST)'],Physical Science and Engineering,https://www.coursera.org/learn/introduction-advanced-vibrations
Kinetics: Studying Spacecraft Motion,4.8,Advanced level,21 hours (approximately),Flexible schedule,129 reviews,Derive the rotational equations of motion and predict and determine torque-free motion equilibria and associated stabilitiesDevelop equations of motion for a rigid body with multiple spinning components and derive and apply the gravity gradient torqueApply the static stability conditions of a dual-spinner configuration and predict changes as momentum exchange devices are introducedDerive equations of motion for systems in which various momentum exchange devices are present,[],"['Continuous Systems and Rigid Bodies', 'Torque Free Motion', 'Gravity Gradients', 'Equations of Motion with Momentum Exchange Devices']",['Hanspeter Schaub'],['University of Colorado Boulder'],Physical Science and Engineering,https://www.coursera.org/learn/spacecraft-dynamics-kinetics
Advanced Functional Ceramics,4.7,,Approx. 16 hours to complete,Flexible schedule,140 reviews,,"['Materials', 'Oxide', 'Material engineering', 'Ceramics', 'Thermoelectric']","['Background of Ceramics', 'Defect in crystal', 'Synthesis of Ceramics', 'Properties and applications of Ceramics', 'Properties and applications of Ceramics']",['Lee Kyu Hyoung'],['Yonsei University'],Physical Science and Engineering,https://www.coursera.org/learn/advanced-functional-ceramics
普通物理學-電磁學、光學及近代物理 (General Physics (1)),4.8,,Approx. 30 hours to complete,Flexible schedule,23 reviews,,[],"['Week 1 靜電學：電荷與電場概念簡介', 'Week 2 會動的電荷：電流', 'Week 3 神秘的磁場', 'Week 4 電與磁的完美結合', 'Week 5 光學', 'Week 6 相對論', 'Week 7 量子的概念']",['朱士維'],['National Taiwan University'],Physical Science and Engineering,https://www.coursera.org/learn/wuli
Building an Ecosystem model with Insight Maker,4.6,Beginner level,,,123 reviews,"Run and configure model simulations, operating with the Stock, Flow, Variable and Link primitives.Experience the workflow behind model building with Insight maker.Create custom simulation displays, and add Value Sliders for primitives. ","['System Dynamics Simulations', 'Insight Making', 'Storytelling', 'Systems Thinking']",['Learn step-by-step'],['Danilo Oliveira Vaz'],['Coursera Project Network'],Physical Science and Engineering,https://www.coursera.org/projects/ecosystem-insight-maker
Nanophotonics and Detectors,4.1,Advanced level,15 hours (approximately),Flexible schedule,21 reviews,Use nanophotonic effects (low dimensional structures) to engineer lasersApply  low dimensional structures to photonic device designSelect and design optical detector for given system and application,[],"['Quantum Cascade Lasers', 'Confined photons ', 'photonic detection', 'metal insulator semiconductor structures ', 'Charge Coupled Devices (CCDs) and Photoconductors', 'P/N Junctions and Avalanche photodiodes (APDs)']",['Juliet Gopinath'],['University of Colorado Boulder'],Physical Science and Engineering,https://www.coursera.org/learn/nanophotonics-detectors
Mécanique de Newton,4.6,,Approx. 22 hours to complete,Flexible schedule,111 reviews,,[],"['Formation de l’esprit scientifique. Calculs de dérivées.', 'Cinématique du point matériel. Calcul vectoriel.', 'Les lois de Newton. Balistique.', 'Action et réaction. Balistique avec frottement.', 'Objectifs de la dynamique. Oscillateur harmonique.', 'Accélération normale et tangentielle. Mouvement circulaire, vitesse angulaire.', 'Coordonnées cylindriques et sphériques. Vitesse et accélération.', 'Clôture']",['Jean-Philippe Ansermet'],['École Polytechnique Fédérale de Lausanne'],Physical Science and Engineering,https://www.coursera.org/learn/mecanique-newton
Electrodynamics: Electric and Magnetic Fields,4.8,Advanced level,12 hours (approximately),Flexible schedule,219 reviews,,[],"['Electrostatic Analogs ', 'Magnetostatics', 'The Magnetic Field in Various Situations', 'Assessing the Vector Potential', 'Induced Currents']",['Seungbum Hong'],['Korea Advanced Institute of Science and Technology(KAIST)'],Physical Science and Engineering,https://www.coursera.org/learn/electrodynamics-electric-magnetic-fields
Plastic electronics,4.6,Intermediate level,Approx. 6 hours to complete,Flexible schedule,215 reviews,,[],"['Introduction to plastic electronics', 'Charge carrier transport in organic semiconductors', 'Optical properties of organic semiconductors', 'Interfaces in plastic electronic devices', 'Plastic electronic devices']",['Gilles Horowitz'],['École Polytechnique'],Physical Science and Engineering,https://www.coursera.org/learn/plastic-electronics
Electrodynamics: Analysis of Electric Fields,4.8,Advanced level,11 hours (approximately),Flexible schedule,159 reviews,,[],"['The Electric Field in Various Circumstances', ""The Electric Field in Various Circumstances (cont'd)"", 'Electrostatic Energy', 'Introduction to Dielectrics', ""Dielectrics (cont'd)""]",['Seungbum Hong'],['Korea Advanced Institute of Science and Technology(KAIST)'],Physical Science and Engineering,https://www.coursera.org/learn/electrodynamics-analysis-of-electric-fields
Silicon Thin Film Solar Cells,4.3,Advanced level,Approx. 5 hours to complete,Flexible schedule,113 reviews,Solar EnergyNanotechnologySemiconductor MaterialsThin Films,[],"['Solar Cell Operation', 'Thin Film Semiconductors', 'Silicon Thin Film Solar Cells']","['Erik Johnson', 'Pr. Bernard Drevillon']",['École Polytechnique'],Physical Science and Engineering,https://www.coursera.org/learn/silicon-thin-film-solar-cells
Introduction to Particle Accelerators (NPAP MOOC),4.7,Intermediate level,Approx. 11 hours to complete,Flexible schedule,187 reviews,You will learn how electrons can create light  You will learn the basic principles of synchrotron light sources and MAX-IVYou will learn how protons can be accelerated in a linear accelerator and how they can produce neutrons by spallation at the ESSYou will learn what particle colliders are and what they can be used for,[],"['Accelerators for Synchrotron Light ', 'Photon light sources and MAX IV', 'Spallation sources and ESS', 'Particle Colliders', 'Stay tuned for upcoming resources ', ' Well done! You have now successfully finalized the course!']","['Francesca Curbis', 'Sverker Werin', 'Mats Lindroos', 'Erik Adli']",['Lund University'],Physical Science and Engineering,https://www.coursera.org/learn/introduction-particle-accelerators
Generative Design for Part Consolidation,4.9,Advanced level,27 hours (approximately),Flexible schedule,61 reviews,Inspect a multi-component assembly.  Identify manufacturing methods.  Practice how to reverse engineer for design intent. Create a Generative Design Outcome.,"['Computer-Aided Design (CAD)', 'Autodesk', 'Mechanical Engineering', 'Manufacturing Engineer', 'Generative Design']","['Review and Analyze a Complex Assembly', 'Set up a Generative Study', 'Select and Post Process an Outcome to Finalize a Design', 'Beneficial Knowledge for Working with Generative Designs']",[],['Autodesk'],Physical Science and Engineering,https://www.coursera.org/learn/generative-design-part-consolidation
Physics 102 - AC Circuits and Maxwell's Equations,4.9,Intermediate level,18 hours (approximately),Flexible schedule,10 reviews,,"['Force Fields', 'Problem Solving', 'Physics', 'Electronic Circuits', 'Electrical Engineering']","['AC Circuits', 'Maxwell and Matter', 'Exam']",['Jason Hafner'],['Rice University'],Physical Science and Engineering,https://www.coursera.org/learn/physics-102-ac-circuits-maxwell-equations
Current-Mode Control,4.9,Intermediate level,13 hours (approximately),Flexible schedule,18 reviews,Understand the operating principles and benefits of current-mode control for dc-dc converters Model and design peak current-mode controlled dc-dc converters Model and design average current-mode controlled dc-dc converters Use computer-aided tools and simulations to verify current-mode controlled dc-dc converters,"['Modeling And Simulation', 'Power Supplies', 'Power Electronics Design', 'Power Electronics', 'Circuit Design']","['Peak Current-Mode Control: Simple Model', 'Peak Current-Mode Control: More Accurate Model', 'High-Frequency Effects in Peak Current-Mode Control', 'Average Current-Mode Control']",['Dr. Dragan Maksimovic'],['University of Colorado Boulder'],Physical Science and Engineering,https://www.coursera.org/learn/current-modecontrol
Phase Diagrams I & II,,Beginner level,15 hours (approximately),Flexible schedule,,The use of principles of phase diagrams to predict microstructures and properties of metals and alloys.,['The ability to use principles of phase diagrams to predict microstructures and properties of metals and alloys for technological applications'],"['Phase Diagrams I & II', 'Module 1: Diffusion and Its Mechanisms', 'Module 2: Eutectic Phase Diagrams', 'Module 3: Eutectic Microstructures', 'Module 4: Microstructures and Properties']",['Terry Alford'],['Arizona State University'],Physical Science and Engineering,https://www.coursera.org/learn/phase-diagrams-1-and-2
"Cities, Climate and Change: Pathways and Opportunities",,Beginner level,Approx. 14 hours to complete,Flexible schedule,,"Increased knowledge on climate neutral and sustainable cities as well as the role of transformative skills and capacities.Improved critical thinking on the opportunities and pathways for climate neutral and sustainable cities.Deeper understanding of the relationship between transformative skills and capacities with climate action in cities.Expanded ability to use systems thinking and the missions approach in the context of cities, climate and change.","['sustainable development', 'Climate Change', 'missions approach', 'Systems Thinking', 'city futures']","['Module: Visions and Plans', 'Module: Data and Tools', 'Module: Finance and Partnerships', 'Module: Engagement and Action', 'Module: Research and Innovation']","['Kes McCormick', 'Björn Wickenberg']",['Lund University'],Physical Science and Engineering,https://www.coursera.org/learn/cities-climate-and-change
La Economía Circular: ¿un mito o una posibilidad?,,Beginner level,Approx. 8 hours to complete,Flexible schedule,,,[],"['La Economía Circular: ¿un mito o una posibilidad?', 'Introducción a la Economía circular y escuelas de pensamiento', 'La necesidad de avanzar hacia sistemas más circulares', 'Identificación de mejoras mediante el análisis de sistemas', 'Análisis de productos: el ecodiseño', 'Análisis de productos: el análisis de ciclo de vida']","['Edmundo Muñoz Alvear', 'Gara Villalba Méndez', 'Joan Rieradevall i Pons', 'Anna Petit Boix', 'Xavier Gabarrell i Durany', 'Laura Talens Peiró']",['Universitat Autònoma de Barcelona'],Physical Science and Engineering,https://www.coursera.org/learn/economia-circular
Introduction to Faecal Sludge Management,4.8,Intermediate level,Approx. 21 hours to complete,Flexible schedule,641 reviews,,[],"['An introduction to faecal sludge management ', 'Overview of fundamentals for design and selection of treatment technologies', 'Treatment technologies for faecal sludge', 'Integrated approach to faecal sludge management ', 'Innovations in faecal sludge management ']",['Dr. Linda Strande'],['École Polytechnique Fédérale de Lausanne'],Physical Science and Engineering,https://www.coursera.org/learn/faecalsludge
"Phases of Matter: Solid, Liquid, Gas and Beyond",,Beginner level,13 hours (approximately),Flexible schedule,,"Define what constitutes a phase of matter.Interpret phases in terms of symmetries, and describe spontaneous symmetry breaking.Identify the competition between energy and entropy, and explain how this produces phase transitions.","['understanding complexity', 'symmetry based analysis', 'mean field theory', 'Spontaneous symmetry breaking']","[' Emergent Phenomena and Phases of Matter', 'Symmetries and Symmetry Breaking', 'Energy, Entropy and Phase Structure', 'Mean Field Theory']",['Rahul Nandkishore'],['University of Colorado Boulder'],Physical Science and Engineering,https://www.coursera.org/learn/phases-of-matter-solid-liquid-gas-and-beyond
Rigid Body Dynamics,4.6,Intermediate level,Approx. 14 hours to complete,Flexible schedule,25 reviews,,[],"['Lecture Note', '1-1 Week', '1-2 Week', '2-1 Week', '2-2 Week', '3-1 Week', '3-2 Week', '4-1 Week', '4-2 Week', '5-1 Week ', '5-2 Week', '6-1 Week', '6-2 Week', '7-1 Week', '7-2 Week']",['Sukyung Park'],['Korea Advanced Institute of Science and Technology(KAIST)'],Physical Science and Engineering,https://www.coursera.org/learn/rigid-body-dynamics
Space is Everywhere,,Beginner level,21 hours (approximately),Flexible schedule,,"You will learn about the cosmos and your place in it, the ways we explore space, and how people and politics play a role in what we learn.Plus you will learn how space influences everything in our world all while finding your pathway to space.","['Music', 'Art', 'Writing', 'Film', 'Journalism']","['The Journalism of Space', 'Space and Music', 'The Art of Space', 'Visualizing Space Exploration', 'Space Through the Ages', 'Space and Movies', 'Science Fiction', 'One Pathway to Space', 'Specialization Wrap Up']",['Chris Koehler'],['University of Colorado Boulder'],Physical Science and Engineering,https://www.coursera.org/learn/space-is-everywhere
"L'Art des Structures 2 : treillis, poutres, dalles et cadres",4.7,Intermediate level,Approx. 46 hours to complete,Flexible schedule,17 reviews,,[],"['Introduction aux treillis et forces aux appuis', 'Treillis à 5, 7 et 9  noeuds ', 'Analyse spécifique et typologie des treillis', 'Tours et consoles', 'Exercices notés', 'Poutres', 'Poutres : section et prédimensionnement', 'Treillis et poutres avec consoles', 'Poutres continues et voiles', 'Grilles de poutres et dalles', 'Cadres et poutres Vierendeel', 'Stabilité', 'Exercices notés']",['Olivier L. Burdet'],['École Polytechnique Fédérale de Lausanne'],Physical Science and Engineering,https://www.coursera.org/learn/structures2
Controle de Sistemas no Plano-s,4.8,Intermediate level,Approx. 9 hours to complete,Flexible schedule,88 reviews,,[],"['Regiões de desempenho e aproximação de segunda ordem', 'O Lugar Geométrico das Raízes', 'Controlador de avanço de fase', 'Controlador de atraso de fase', 'Controladores de avanço e atraso, atraso de transporte']","['Rubens Junqueira Magalhães Afonso', 'Jackson Paul Matsuura']",['Instituto Tecnológico de Aeronáutica'],Physical Science and Engineering,https://www.coursera.org/learn/controle-s
Climate Change in Water and Sanitation Utilities,,Beginner level,Approx. 16 hours to complete,Flexible schedule,,"Recognize the challenges that urban water and sanitation utilities face regarding climate change and sustainability.Identify strategies to assess climate risks, greenhouse gas emissions, and energy consumption using tools like ECAM.Identify strategies to reduce greenhouse gas emissions for water and sanitation utilities to transition to low-carbon operations.",[],"['Start Here', 'Module 1: Climate Change in the Urban Water Sector', 'Module 2: Roadmap to a Low-Carbon Urban Water Utility', 'Module 3: Greenhouse Gas Emissions and Fundamentals of Calculating', 'Module 4: Climate Risks in the Water and Sanitation Sector']","['Maria Eugenia de la Pena', 'Martin Kerres', 'Alfred Hans Grunwaldt']",['Banco Interamericano de Desarrollo'],Physical Science and Engineering,https://www.coursera.org/learn/climate-change-in-water-and-sanitation-utilities
Analizar e incrementar - Parte 1,4.8,Intermediate level,21 hours (approximately),Flexible schedule,25 reviews,,"['Toma de decisiones', 'Estadística', 'diagnóstico', 'Análisis', 'Solución de problemas']","['Concepto de variación e inferencia estadística', 'Pruebas de hipótesis', 'Herramientas de Flujo continuo', 'Regresión lineal']","['Edgardo Jorge Escalante Vázquez ', 'Mohammad Reza Azarang Esfandiari']",['Tecnológico de Monterrey'],Physical Science and Engineering,https://www.coursera.org/learn/analizar-e-incrementar-p1
