Preparing for Google Cloud Certification: Machine Learning Engineer Professional Certificate,4.6,Intermediate level,3 months at 10 hours a week,Flexible schedule,"1,924 reviews","Learn the skills needed to be successful in a machine learning engineering rolePrepare for the Google Cloud Professional Machine Learning Engineer certification examUnderstand how to design, build, productionalize ML models to solve business challenges using Google Cloud technologiesUnderstand the purpose of the Professional Machine Learning Engineer certification and its relationship to other Google Cloud certifications","['Tensorflow', 'Machine Learning', 'Feature Engineering', 'Google Cloud', 'Cloud Computing']","['Google Cloud Big Data and Machine Learning Fundamentals', 'How Google does Machine Learning', 'Launching into Machine Learning', 'TensorFlow on Google Cloud', 'Feature Engineering', 'Machine Learning in the Enterprise', 'Production Machine Learning Systems', 'Machine Learning Operations (MLOps): Getting Started', 'ML Pipelines on Google Cloud']",['Google Cloud Training'],['Google Cloud'],Information Technology,https://www.coursera.org/professional-certificates/preparing-for-google-cloud-machine-learning-engineer-professional-certificate
IBM Cybersecurity Analyst Assessment ,4.8,Intermediate level,4 hours (approximately),Flexible schedule,"1,047 reviews",,"['Computer Security Incident Management', 'professional certificate', 'cybersecurity analyst']",['IBM Cybersecurity Analyst Professional Certificate Assessment Exam'],['IBM Skills Network Team'],['IBM'],Information Technology,https://www.coursera.org/learn/ibm-cybersecurity-analyst-assessment
Retrieve Data with Multiple-Table SQL Queries,4.6,Intermediate level,,,90 reviews,Explain the need for multiple-table queries in data retrieval.Generate successful SQL multiple-table queries for data retrieval.Recognize relationships among tables in a relational database.,"['Data Analysis', 'Sql Commands', 'Relational Database', 'SQLiteStudio']",['Learn step-by-step'],['Judy Richardson'],['Coursera Project Network'],Information Technology,https://www.coursera.org/projects/multiple-table-sql-queries
Mitigating Security Vulnerabilities on Google Cloud,4.7,Intermediate level,6 hours (approximately),Flexible schedule,709 reviews,"Manage protection against distributed denial of service attacks (DDoS).Manage content-related vulnerabilities.Implement Google Cloud monitoring, logging, auditing, and scanning solutions.",[],"['Welcome to Mitigating Security Vulnerabilities on Google Cloud', 'Protecting against Distributed Denial of Service Attacks (DDoS)', 'Content-Related Vulnerabilities: Techniques and Best Practices ', 'Monitoring, Logging, Auditing and Scanning']",['Google Cloud Training'],['Google Cloud'],Information Technology,https://www.coursera.org/learn/mitigating-security-vulnerabilites-gcp
Reliable Cloud Infrastructure: Design and Process 日本語版,4.6,Intermediate level,8 hours (approximately),Flexible schedule,80 reviews,,[],"['はじめに', 'サービスの定義', 'マイクロサービスの設計とアーキテクチャ', 'DevOps 自動化', 'ストレージ ソリューションの選択', 'Google Cloud とハイブリッド ネットワーク アーキテクチャ', 'Google Cloud へのアプリケーションのデプロイ', '信頼性の高いシステムの設計', 'セキュリティ', 'メンテナンスとモニタリング']",['Google Cloud Training'],['Google Cloud'],Information Technology,https://www.coursera.org/learn/cloud-infrastructure-design-process-jp
Operating Systems Fundamentals,4.8,Beginner level,30 hours (approximately),Flexible schedule,24 reviews,"Learners will master basic management of Linux from the command line including file management, operating system management and security.","['Managing Jobs and Processes', 'Managing the File System in Linux', 'User and Group Accounts', 'Managing Linux Permissions and Ownership', 'Performing Basic Linux Tasks']","['Performing Basic Linux Tasks', 'Managing the File System in Linux', 'Working with Text Files', 'User and Group Accounts', 'Managing Linux Permissions and Ownership', 'Managing Jobs and Processes', 'Managing Partitions and the Linux File System', 'Manage System Services', 'Capstone']",['Shadow Farrell'],"['Akamai Technologies, Inc.']",Information Technology,https://www.coursera.org/learn/akamai-operating-systems
Getting Started with Data Warehousing and BI Analytics,4.4,Intermediate level,16 hours (approximately),Flexible schedule,140 reviews,"Explore the architecture, features, and benefits of data warehouses, data marts, and data lakes and identify popular data warehouse system vendors.Design and populate a data warehouse, and model and query data using CUBE, ROLLUP, and materialized views.Identify popular data analytics and business intelligence tools and vendors and create data visualizations using IBM Cognos Analytics.Design and load data into a data warehouse, write aggregation queries, create materialized query tables, and create an analytics dashboard.","['Data Warehousing', 'Business Intelligence (BI)', 'cognos analytics', 'Cube and Rollup', 'Star and Snowflake Schema']","['Data Warehouses, Data Marts, and Data Lakes', 'Designing, Modeling and Implementing Data Warehouses', 'Data Warehouse Analytics', 'Final Assignment and Final Quiz']","['Ramesh Sannareddy', 'Rav Ahuja']",['IBM'],Information Technology,https://www.coursera.org/learn/getting-started-with-data-warehousing-and-bi-analytics
Network Basics on Microsoft Windows,,Beginner level,2 hours,,,Locate network and internet settingsandIP address.Identify public and private IP addresses.Use terminal commands via the Command-Line Utility (CLI),"['Network Performance', 'Microsoft Windows Network Settings', 'Command-Line Utility Interface (CLI)', 'Wireless Networks', 'Network Troubleshooting']",['Learn step-by-step'],['IBM Skills Network Team'],['IBM'],Information Technology,https://www.coursera.org/projects/network-basics-on-microsoft-windows
JavaScript Security Part 3,4.7,Intermediate level,2 hours (approximately),Flexible schedule,15 reviews, Serverless JavascriptWeb Developer Desktop Security.,"['Node.Js', 'JavaScript']","['Serverless Javascript', 'Web Developer Desktop Security']",['Vladimir de Turckheim'],['Infosec'],Information Technology,https://www.coursera.org/learn/javascript-security-part-3
Logging and Monitoring in Google Cloud,4.7,Beginner level,8 hours (approximately),Flexible schedule,194 reviews,"Explain the purpose and capabilities of Google Cloud’s operations suite.Implement monitoring for multiple cloud projects.Create effective monitoring dashboards and alerts.Create alerting policies, uptime checks and alerts.Explain how to collect logs using Cloud Logging and export for further analysis",[],"['Introduction', 'Introduction to Google Cloud Operations Suite', 'Monitoring Critical Systems', 'Alerting Policies', 'Advanced Logging and Analysis', 'Working with Audit Logs', 'Course Summary']",['Google Cloud Training'],['Google Cloud'],Information Technology,https://www.coursera.org/learn/logging-monitoring-observability-google-cloud
CompTIA a+ Cyber,,Beginner level,Approx. 31 hours to complete,Flexible schedule,,Understand and perform basic security tasks for Windows computers and home networksRecognize the procedures and tools used in cybersecurity to protect enterprise networksDescribe the tools used for managing Linux computers and creating automation scripts,"['Server Administrator', 'Network Security', 'Operational Risk Management', 'Application Security', 'Cyber Security Management']","['Module 1: Security Operations Fundamentals', 'Module 2: Microsoft Windows Administration', 'Module 3: Secure Network Client Fundamentals', 'Module 4: Enterprise Campus Network Fundamentals', 'Module 5: Enterprise Network Application Fundamentals', 'Module 6: Cybersecurity Controls', 'Module 7: Linux App Server Fundamentals', 'Module 8: Automation Scripting Fundamentals', 'Module 9: Data Management Fundamentals ']",['CompTIA Fast Track to Tech'],['CompTIA'],Information Technology,https://www.coursera.org/learn/comptia-aplus-cyber
Cybersecurity for Business Specialization,4.7,Beginner level,1 months at 10 hours a week,Flexible schedule,"1,057 reviews",,"['Cybersecurity', 'Information Security (INFOSEC)', 'Risk Assessment', 'Attack Surface']","['Introduction to Cybersecurity for Business', 'Cyber Threats and Attack Vectors', 'Detecting and Mitigating Cyber Threats and Attacks', 'Proactive Computer Security']",['Greg Williams'],['University of Colorado System'],Information Technology,https://www.coursera.org/specializations/cyber-security-business
Microsoft Windows Defender and Firewall for Beginners,4.2,Beginner level,2 hours,,54 reviews,Locate Microsoft Windows Security Virus and Threat Protection SettingsRun Microsoft Windows Defender Antivirus Quick Scan Configure Microsoft Windows Firewall Rules ,"['Cybersecurity', 'Information Security (INFOSEC)', 'Microsoft Windows Defender', 'Troubleshooting', 'Cyber Defense']",['Learn step-by-step'],['IBM Skills Network Team'],['IBM'],Information Technology,https://www.coursera.org/projects/microsoft-windows-defender-and-firewall-for-beginners
AWS Cloud Technology Consultant Professional Certificate,4.8,Beginner level,4 months at 10 hours a week,Flexible schedule,204 reviews,"Understand and translate business goals and drivers into appropriate technical solutionsProvide technical direction and oversight to cloud implementation teamsCreate the conceptual, logical and physical design for cloud-based solutions for infrastructure and platformsLearn how to gather technical requirements, assess client capabilities and analyze findings to provide appropriate cloud solution recommendations","['Cloud Computing Security', 'Cloud Management', 'Problem Solving', 'Cloud Strategy', 'Data Management', 'Cloud Architecture', 'Interpersonal Communication', 'teamwork']","['Introduction to Information Technology and AWS Cloud', 'AWS Cloud Technical Essentials', 'Providing Technical Support for AWS Workloads', 'Developing Applications in Python on AWS', 'Skills for Working as an AWS Cloud Consultant', 'DevOps on AWS and Project Management', 'Automation in the AWS Cloud', 'Data Analytics and Databases on AWS', 'Capstone: Following the AWS Well Architected Framework']","['Oksana Hoeckele', 'Seph Robinson', 'Alex G.', 'Rafael Lopes', 'Russell Sayers', 'Morgan Willis']",['Amazon Web Services'],Information Technology,https://www.coursera.org/professional-certificates/aws-cloud-technology-consultant
Cybersecurity for Tech Professionals,4.7,Intermediate level,Approx. 11 hours to complete,Flexible schedule,107 reviews,Conocerás los riesgos de la era digital y cómo las personas u organizaciones podemos evitar incidentes de seguridad (o minimizar sus consecuencias). ,"['Gestión del Fraude', 'Ciberseguridad', 'Respuesta ante incidentes', 'Securización de las Operaciones', 'gestión de crisis']","['INTRODUCCIÓN', 'ESSENTIALS I', 'ESSENTIALS II', 'SECOPS FUNDAMENTALS ', 'CRISIS MANAGEMENT', 'DATA INFORMATION SECURITY', 'FIGHT FRAUD']",[],['Campus BBVA'],Information Technology,https://www.coursera.org/learn/cybersecurity-for-tech-professionals
"Cloud Computing Applications, Part 1: Cloud Systems and Infrastructure",4.3,Intermediate level,15 hours (approximately),Flexible schedule,819 reviews,,"['Cloud Infrastructure', 'Cloud Applications', 'Cloud Computing', 'Cloud Storage']","['Course Orientation ', 'Module 1: Introduction to Cloud Computing', 'Module 2: Foundations: Containers, Virtual Machine, JVM', 'Module 3: MAAS, PAAS, Web Services', 'Module 4: Storage: Ceph, SWIFT, HDFS, NAAS, SAN, Zookeeper', 'Course Conclusion']","['Reza Farivar', 'Roy H. Campbell']",['University of Illinois at Urbana-Champaign'],Information Technology,https://www.coursera.org/learn/cloud-applications-part1
IBM z/OS Mainframe Practitioner Professional Certificate,4.7,Intermediate level,1 months at 10 hours a week,Flexible schedule,814 reviews,,"['Mainframe', 'security', 'IBM Z', 'z systems', 'Linux']","['Introduction to Enterprise Computing', 'Getting Started on Mainframe with z/OS Commands and Panels', 'Basic System Programming on IBM Z']",['Jeff Bisti'],['IBM '],Information Technology,https://www.coursera.org/professional-certificates/ibm-z-mainframe
Linux Fundamentals,4.5,Beginner level,17 hours (approximately),Flexible schedule,707 reviews,,[],"['Linux Operating System', 'Linux Services', 'View, Create, Copy, Move and Remove Files', 'Search and Analyze Text']",['Aspen Olmsted'],['LearnQuest'],Information Technology,https://www.coursera.org/learn/linux-fundamentals
Microsoft Power Platform Fundamentals,4.2,Beginner level,Approx. 25 hours to complete,Flexible schedule,111 reviews,"How to create simple apps, visualize data, automate a business process and build a chatbotHow to describe the business value of Power PlatformHow to identify the core components of Power Platform and how to demonstrate the capabilities of Power BIHow to describe the capabilities of Power Apps, and how to demonstrate the business value of Power Virtual Agents","['Data Analysis', 'Business Process', 'Data Visualization', 'power bi', 'Chatbot']","['Introduction to Microsoft Power Platform', 'Create custom solutions for everyday problems', 'Build an automated solution', 'Power BI', 'Power Virtual Agents', 'The practice exam']",[' Microsoft'],['Microsoft'],Information Technology,https://www.coursera.org/learn/microsoft-power-platform-fundamentals
Fintech: Foundations & Applications of Financial Technology Specialization,4.6,Beginner level,1 months at 10 hours a week,Flexible schedule,"3,454 reviews",Explain crypto-currency and blockchain in financial contextsEvaluate investment products using Modern Portfolio TheoryIdentify the regulatory concerns presented by the most common financial technologies,"['Investment Management', 'Cryptocurrency', 'regulation', 'Blockchain']","['FinTech: Foundations, Payments, and Regulations', 'Cryptocurrency and Blockchain: An Introduction to Digital Currencies', 'Lending, Crowdfunding, and Modern Investing', 'Application of AI, InsurTech, and Real Estate Technology']","['Sarah Hammer', 'Jessica Wachter', 'Christopher Geczy', 'David Musto', 'Natasha Sarin']",['University of Pennsylvania'],Information Technology,https://www.coursera.org/specializations/wharton-fintech
Back-end Application Development Capstone Project,5.0,Advanced level,18 hours (approximately),Flexible schedule,19 reviews,"Demonstrate proficiency to develop and deploy backend services and applications Apply your back-end development skills to author microservices and REST APIs in FlaskCreate and query databases like MongoDB and integrate with Django appsContainerize microservices using Docker and deploy using Kubernetes, OpenShift and serverless","['Django (Web Framework)', 'Mongodb', 'Docker', 'Flask', 'Representational State Transfer (REST)']","['Module 1: Getting Started', 'Creating Get Songs Service with Flask', 'Module 3: Main Django Application', 'Module 4: Deploy your application and services', 'Module 5: Final Submission and Peer Review']",['IBM Skills Network Team'],['IBM'],Information Technology,https://www.coursera.org/learn/backend-development-capstone-project
Cybersecurity for Managers,4.7,Beginner level,Approx. 8 hours to complete,Flexible schedule,340 reviews,Conocerás los riesgos de la era digital y cómo las personas u organizaciones podemos evitar incidentes de seguridad (o minimizar sus consecuencias). ,"['procesos de seguridad', 'gestión de crisis', 'defensa personal', 'ciberserguridad']","['INTRODUCCIÓN', 'ESSENTIALS I', 'ESSENTIALS II', 'PERSONAL DEFENSE', 'CRISIS MANAGEMENT', 'BUSINESS PROCESS SECURITY']",[],['Campus BBVA'],Information Technology,https://www.coursera.org/learn/cybersecurity-for-managers
Introduction to Information Systems for Business Specialization,4.7,Intermediate level,1 months at 10 hours a week,Flexible schedule,16 reviews,Explain key concepts and frameworks in information systems and cloud computingIdentify different business applications used to solve problems in different business domainsApply knowledge to solve real-life problems in different business domainsDevelop solutions to maintain strategic direction for an organization or firm,"['Cloud Technology', 'Cybersecurity', 'Information Systems', 'Networking', 'Data Management']","['Foundations of Information Systems for Business', 'Cloud Transformation', 'Capstone: Design Thinking for IS in Business']","['Carlos Buskey', 'Alton Henley']",['Howard University'],Information Technology,https://www.coursera.org/specializations/introduction-to-information-systems-for-business
Database Design and Diagramming in Dia,4.6,Beginner level,,,236 reviews,Demonstrate proficiency with a diagramming tool.Describe the phases of database design.Draw an Entity Relationship Diagram.,"['Data Model', 'Entity–Relationship (E-R) Model', 'Database (DBMS)', 'Diagramming', 'Dia']",['Learn step-by-step'],['Judy Richardson'],['Coursera Project Network'],Information Technology,https://www.coursera.org/projects/database-design-and-diagramming-in-dia
Preparing for Your Associate Cloud Engineer Journey,4.7,Intermediate level,3 hours (approximately),Flexible schedule,"3,054 reviews",Describe the five domains covered on the Associate Cloud Engineer Certification exam.Identify gaps in your knowledge and skills for each domain and create a study plan.,"['Google Cloud', 'Cloud Computing', 'GCP Infrastructure', 'GCP ACE Certification']","[' Introduction', 'Setting Up a Cloud Solution Environment', 'Planning and Configuring a Cloud Solution', 'Deploying and Implementing a Cloud Solution', ' Ensuring Successful Operation of a Cloud Solution', 'Configuring Access and Security', 'Module 6: Your next steps']",['Google Cloud Training'],['Google Cloud'],Information Technology,https://www.coursera.org/learn/preparing-cloud-associate-cloud-engineer-exam
Programming with Cloud IoT Platforms,4.3,Beginner level,Approx. 7 hours to complete,Flexible schedule,300 reviews,,[],"['Samsung ARTIK Cloud Platform', 'Microsoft Azure IoT Suite', 'Amazon Web Services IoT', 'IBM Watson IoT', 'Google Cloud IoT']",['James Won-Ki HONG'],['Pohang University of Science and Technology(POSTECH)'],Information Technology,https://www.coursera.org/learn/cloud-iot-platform
Apoio Técnico de TI da Google Professional Certificate,4.9,Beginner level,6 months at 10 hours a week,Flexible schedule,210 reviews,"Adquirir as aptidões necessárias para ter sucesso numa função de TI de nível inicialAprender a executar tarefas diárias de apoio técnico de TI, incluindo montagem de computadores, redes sem fios, instalação de programas e serviço de apoio ao clienteAprender a prestar apoio técnico completo ao cliente, desde a identificação de problemas até à resolução e depuração dos mesmosAprender a utilizar sistemas, incluindo Linux, sistemas de nomes de domínio, interface de linhas de comando e código binário","['Customer Service', 'Network Protocols', 'Cloud Computing', 'Encryption Algorithms', 'Debugging']","['Princípios básicos de apoio técnico', 'Os vários elementos das redes informáticas', 'Interagir com sistemas operativos', 'Serviços de infraestruturas e administração de sistemas', 'Segurança de TI: defesa contra as artes negras digitais']",['Google Career Certificates'],['Google'],Information Technology,https://www.coursera.org/professional-certificates/google-it-pt2
Architecting with Google Compute Engine 日本語版 Specialization,4.6,Intermediate level,1 months at 10 hours a week,Flexible schedule,438 reviews,,"['Load Balancing', 'Virtual Private Network (VPN)', 'Google Cloud Platform', 'Autoscaling', 'Google Compute Engine', 'Virtual Machine', 'Network Architecture', 'Google App Engine (GAE)', 'Cloud Computing']","['Google Cloud Fundamentals: Core Infrastructure 日本語版', 'Essential Cloud Infrastructure: Foundation - 日本語版', 'Essential Cloud Infrastructure: Core Services 日本語版', 'Elastic Cloud Infrastructure: Scaling and Automation 日本語版', 'Reliable Cloud Infrastructure: Design and Process 日本語版']",['Google Cloud Training'],['Google Cloud'],Information Technology,https://www.coursera.org/specializations/gcp-architecture-jp
Security Principles,4.7,Beginner level,5 hours (approximately),Flexible schedule,250 reviews,,"['Risk', 'security', 'governance', 'Information Assurance']","['Course Introduction', 'Information Assurance', 'Risk Mitigation Process ', 'Security Controls', 'Governance', '(ISC)² Code of Ethics', 'Security Principles Review']",['(ISC)² Education & Training'],['ISC2'],Information Technology,https://www.coursera.org/learn/-security-principles
Preparing for Google Cloud Certification: Cloud Engineer Professional Certificate,4.8,Intermediate level,1 months at 10 hours a week,Flexible schedule,"9,537 reviews",Learn the skills needed to be successful in a cloud engineering rolePrepare for the Associate Cloud Engineer certificationLearn about the infrastructure and platform services provided by Google Cloud Platform,"['Load Balancing', 'Virtual Private Network (VPN)', 'Google Cloud Platform', 'Autoscaling', 'Google Cloud', 'Cloud Computing', 'GCP Infrastructure', 'GCP ACE Certification', 'Google Compute Engine', 'Virtual Machine', 'Network Architecture', 'Google App Engine (GAE)', 'Debugging', 'Cloud Storage', 'Data Store']","['Google Cloud Fundamentals: Core Infrastructure', 'Essential Google Cloud Infrastructure: Foundation', 'Essential Google Cloud Infrastructure: Core Services', 'Elastic Google Cloud Infrastructure: Scaling and Automation', 'Architecting with Google Kubernetes Engine: Foundations', 'Preparing for Your Associate Cloud Engineer Journey']",['Google Cloud Training'],['Google Cloud'],Information Technology,https://www.coursera.org/professional-certificates/cloud-engineering-gcp
Foundations of Information Systems for Business,4.7,Intermediate level,19 hours (approximately),Flexible schedule,14 reviews,Explain key concepts and frameworks in information systems and cloud computing.Identify and apply different business applications to solve problems in different business domains.,[],"['Foundations of Information Systems', 'Technology and Hardware Components', 'Business Applications', 'Strategies and Ethics']","['Carlos Buskey', 'Alton Henley']",['Howard University'],Information Technology,https://www.coursera.org/learn/foundations-of-information-systems-for-business
Introduction and Programming with IoT Boards,4.6,Beginner level,Approx. 7 hours to complete,Flexible schedule,"1,708 reviews",,"['Syntax', 'Arduino', 'Problem Solving', 'Internet Of Things (IOT)']","['Introduction to IoT', 'Networking Technologies for IoT', 'IoT Programming with Arduino', 'IoT Programming with Raspberry Pi', 'IoT Programming with ARTIK Board']",['James Won-Ki HONG'],['Pohang University of Science and Technology(POSTECH)'],Information Technology,https://www.coursera.org/learn/introduction-iot-boards
Preparing for Google Cloud Certification: Cloud Architect Professional Certificate,4.8,Intermediate level,1 months at 10 hours a week,Flexible schedule,"10,760 reviews",Learn the skills needed to be successful in a cloud architect rolePrepare for the Professional Cloud Architect certificationLearn about the infrastructure and platform services provided by Google Cloud Platform,"['Load Balancing', 'Virtual Private Network (VPN)', 'Google Cloud Platform', 'Autoscaling', 'Google Compute Engine', 'Virtual Machine', 'Network Architecture', 'Google App Engine (GAE)', 'Cloud Computing', 'Disaster Recovery', 'Site Reliability Engineering', 'Debugging', 'Cloud Storage', 'Data Store']","['Google Cloud Fundamentals: Core Infrastructure', 'Essential Google Cloud Infrastructure: Foundation', 'Essential Google Cloud Infrastructure: Core Services', 'Elastic Google Cloud Infrastructure: Scaling and Automation', 'Reliable Google Cloud Infrastructure: Design and Process', 'Architecting with Google Kubernetes Engine: Foundations', 'Preparing for your Professional Cloud Architect Journey']",['Google Cloud Training'],['Google Cloud'],Information Technology,https://www.coursera.org/professional-certificates/gcp-cloud-architect
