Introduction to Technical Support ,4.8,Beginner level,12 hours (approximately),Flexible schedule,671 reviews,"Define technical support, tech support, IT support, customer support mindset, the various levels of IT support, and the escalation matrix Discover soft and technical skills required and opportunities available for a career in Technical SupportExplore the features and benefits of ticketing systemsIdentify the various methodologies and frameworks popular in technical support","['Customer Service', 'Technical Support', 'Information Technology (IT) Support', 'Ticketing Systems', 'Service Level Agreements (SLA)']","['Industry Professionals’ Guide to Technical Support', 'Technical Support Skills and Opportunities', 'Support Tools, Support Tiers, and Service-Level Agreements', 'Ticketing Systems', 'Final Hands-on Project and Quiz']","['Amy Norton', 'Rav Ahuja']",['IBM'],Math and Logic,https://www.coursera.org/learn/introduction-to-technical-support
Introduction to Systems Engineering,4.7,,Approx. 22 hours to complete,Flexible schedule,742 reviews,,[],"['Course Welcome & Module 1 (Introduction to Systems and System Life Cycle)', 'Systems Engineering and its Relevance and Benefits', 'Needs and Requirements', 'Requirements Elicitation and Elaboration', 'Conceptual Design', 'Preliminary and Detailed Design', 'Construction, Production, and Utilisation', 'Systems Engineering Management', 'Final Exam and Information About Further Study']","['Dr Ian  Faulconbridge ', 'Dr Mike Ryan']",['UNSW Sydney (The University of New South Wales)'],Math and Logic,https://www.coursera.org/learn/systems-engineering
Introduction to Scripting in Python Specialization,4.7,Beginner level,1 months at 10 hours a week,Flexible schedule,"2,904 reviews",,"['Codeskulptor', 'Data Analysis', 'Python Programming', 'Data Visualization']","['Python Programming Essentials', 'Python Data Representations', 'Python Data Analysis', 'Python Data Visualization']","['Scott Rixner', 'Joe Warren']",['Rice University'],Math and Logic,https://www.coursera.org/specializations/introduction-scripting-in-python
Object Oriented Java Programming: Data Structures and Beyond Specialization,4.7,Intermediate level,4 months at 10 hours a week,Flexible schedule,"3,374 reviews",,"['Data Structure', 'Problem Solving', 'Java Programming', 'Object-Oriented Programming (OOP)']","['Object Oriented Programming in Java', 'Data Structures and Performance', 'Advanced Data Structures in Java', 'Mastering the Software Engineering Interview', 'Capstone: Analyzing (Social) Network Data']","['Christine Alvarado', 'Leo Porter', 'Mia Minnes']",['University of California San Diego'],Math and Logic,https://www.coursera.org/specializations/java-object-oriented
R Programming,4.5,Intermediate level,57 hours (approximately),Flexible schedule,"22,148 reviews",Understand critical programming language conceptsConfigure statistical programming softwareMake use of R loop functions and debugging toolsCollect detailed information using R profiler,"['Data Analysis', 'Debugging', 'R Programming', 'Rstudio']","['Week 1: Background, Getting Started, and Nuts & Bolts', 'Week 2: Programming with R', 'Week 3: Loop Functions and Debugging', 'Week 4: Simulation & Profiling']","['Roger D. Peng, PhD', 'Jeff Leek, PhD', 'Brian Caffo, PhD']",['Johns Hopkins University'],Math and Logic,https://www.coursera.org/learn/r-programming
Business Model Innovation,4.8,,Approx. 14 hours to complete,Flexible schedule,544 reviews,"Define what a business model is and why it enables you to approach innovation and strategy from a completely different angleUnderstand the 3 components of the business model and how they are linked Stimulate your creativity by capitalizing on the 14 directions toolboxAnalyze existing business models, create new ones or adapt existing ones using the Odyssey 3.14 approach","['Strategic Management', 'Business Model', 'Business Modeling', 'Business Strategy']","['MODULE 1: INTRODUCTION TO BUSINESS MODEL INNOVATION', 'MODULE 2: THE 3 COMPONENTS OF A BUSINESS MODEL', ' MODULE 3: 7 DIRECTIONS FOR THE VALUE PROPOSITION ', 'MODULE 4: 7 DIRECTIONS FOR THE VALUE ARCHITECTURE', ""MODULE 5: IT'S YOUR TURN TO APPLY THE ODYSSEY 3.14 APPROACH!""]","['Hélène Musikas', 'Laurence Lehmann-Ortega']",['HEC Paris'],Math and Logic,https://www.coursera.org/learn/business-model
Programming in Python,4.6,Beginner level,44 hours (approximately),Flexible schedule,"1,194 reviews","Foundational programming skills with basic Python Syntax.How to use objects, classes and methods.","['Computer Programming', 'Django (Web Framework)', 'Python Programming', 'Application Programming Interfaces (API)', 'Cloud Hosting']","['Getting started with Python', 'Basic Programming with Python', 'Programming paradigms', 'Modules, packages, libraries and tools', 'End-of-Course Graded Assessment']",['Taught by Meta Staff'],['Meta'],Math and Logic,https://www.coursera.org/learn/programming-in-python
"Everyday Excel, Part 1",4.7,Beginner level,23 hours (approximately),Flexible schedule,"3,257 reviews","Navigating Excel, editing the worksheet (including inserting/deleting cells, columns, and rows), and cell formatting.Expression entry and common Excel formulas (including logical functions, text functions, and financial functions).Data management (sorting, filtering, consolidating, removing duplicates, data validation, and one-way lookups).Data visualization (scatter plots, column charts, pie charts, Slicers, Sparklines, and Pivot Tables).","['Spreadsheet', 'Microsoft Excel', 'Problem Solving', 'Data Management', 'Real World']","['Navigating Excel', 'Expression Entry and Common Excel Functions', 'More Excel functions', 'Managing Data', ' Plotting, Importing Data, and Converting to Other File Types']",['Charlie Nuttelman'],['University of Colorado Boulder'],Math and Logic,https://www.coursera.org/learn/everyday-excel-part-1
Politics and Economics of International Energy,4.7,Beginner level,Approx. 29 hours to complete,Flexible schedule,"1,724 reviews",,[],"[' Week #1 : Introduction to global energy trends and scenarios', 'Week #2 : Policies for decarbonisation', 'Week #3 : Renewable energy sources', 'Week #4 : Oil production, reserves and ressources', 'Week #5 : The economics and geopolitics of natural gas', 'Week #6 : Nuclear Energy', 'Week #7 : Security of supply and demand', 'Week #8 : Energy and development']",['Giacomo Luciani'],['Sciences Po'],Math and Logic,https://www.coursera.org/learn/global-energy
Fractal Data Science  Professional Certificate,4.4,Beginner level,5 months at 10 hours a week,Flexible schedule,45 reviews," Apply structured problem-solving techniques to dissect and address complex data-related challenges encountered in real-world scenarios.   Utilize SQL proficiency to retrieve, manipulate data and employ data visualization skills using Power BI to communicate insights.Apply Python expertise for data manipulation, analysis and implement machine learning algorithms to create predictive models for applications.Create compelling data stories to influence your audience and master the art of critically analyzing data while making decisions and recommendations.","['Decision-Making', 'Python Programming', 'Problem Solving', 'Machine Learning', 'Data storytelling', 'SQL', 'power bi']","['Structured Approach to Problem Solving', 'Data Analysis Using SQL', 'Insights of Power BI', 'Python for Data Science', 'Human Decision Making and its Biases', 'Foundations of Machine Learning ', 'Advanced Machine Learning Algorithms', 'Data Storytelling']","['Fractal Analytics ', 'Analytics Vidhya']",['Fractal Analytics'],Math and Logic,https://www.coursera.org/professional-certificates/fractal-data-science
Kotlin for Java Developers,4.7,Intermediate level,Approx. 25 hours to complete,Flexible schedule,"2,007 reviews",,[],"['Introduction', 'Starting up with Kotlin', 'Nullability, Functional Programming', 'Properties, OOP, Conventions', 'Sequences, Lambdas with Receiver, Types']","['Andrey Breslav', 'Svetlana Isakova']",['JetBrains'],Math and Logic,https://www.coursera.org/learn/kotlin-for-java-developers
Introduction to Networking and Cloud Computing,4.9,Beginner level,25 hours (approximately),Flexible schedule,172 reviews,"How to set up a cloud computing environment, virtual machines and cloud services.How to set up common network infrastructure and monitoring.How to use network security components, approaches and mitigation.How to produce a coherent expansion plan for a business enterprise to take advantage of cloud infrastructure. ","['Cloud Computing Security', 'Network Monitoring', 'Network Security', 'Computer Network']","['Computer Networking', 'Network devices and protocols', 'Network security', 'Cloud computing and networking', 'Networking and cloud computing']",[' Microsoft'],['Microsoft'],Math and Logic,https://www.coursera.org/learn/introduction-to-networking-and-cloud-computing
Improving Leadership & Governance in Nonprofit Organizations Specialization,4.5,Beginner level,3 months at 10 hours a week,Flexible schedule,180 reviews,,"['Onboarding', 'Strategic Leadership', 'Management', 'Corporate Governance', 'Leadership Development']","['Introduction to the Nonprofit Sector, Nonprofit Organizations, Nonprofit Leadership and Governance', 'The Roles and Responsibilities of Nonprofit Boards of Directors within the Governance Process', 'The Factors that Influence the Effectiveness of Boards and the Governance Process', 'Capstone - Managing Board Change for Higher Levels of Leadership and Governance Effectiveness ']","['Prof. Vic Murray, PhD', 'Prof. Yvonne Cafik Harrison, PhD']","['The State University of New York', 'University at Buffalo']",Math and Logic,https://www.coursera.org/specializations/nonprofit
The Arts and Science of Relationships: Understanding Human Needs,4.5,Beginner level,Approx. 31 hours to complete,Flexible schedule,"1,635 reviews",,"['Psychology', 'Assertiveness', 'Communication', 'Building Relationships']","['Module 1 - Relationships in Our Lives', 'Module 2 - Getting Started', 'Module 3 - Communication', 'Module 4 - Building Relationships that Work for You', 'Module 5 - Challenges, Endings, and Transformation', 'Module 6 - Relationships & Self']",['A. Ka Tat Tsang'],['University of Toronto'],Math and Logic,https://www.coursera.org/learn/human-needs
Build a Modern Computer from First Principles: Nand to Tetris Part II (project-centered course),4.9,,Approx. 89 hours to complete,Flexible schedule,496 reviews,,"['Computer Architecture', 'Compiler Construction', 'Compiler', 'Operating System']","['Getting Started', 'Machine Language', 'Virtual Machine I: Stack Arithmetic', 'Virtual Machine II: Program Control', 'High-Level Language', 'Compiler I: Syntax Analysis', 'Compiler II: Code Generation', 'Operating System', 'Postscript: More Fun to Go']",['Shimon Schocken'],['Hebrew University of Jerusalem'],Math and Logic,https://www.coursera.org/learn/nand2tetris2
Building Strategic Foresight Capabilities,4.9,Intermediate level,Approx. 10 hours to complete,Flexible schedule,108 reviews,,"['Strategic Thinking', 'Creativity', 'Innovation', 'Organizational foresight', 'Future Forecasting']","['Introduction, Scanning for signals and Developing drivers of change', 'Why scenario thinking is key to prepare for uncertain futures', 'Developing scenarios and working with stakeholders', 'Developing future-oriented and unique strategies', 'Building organisational foresight capabilities', 'Exam : Final quiz']","['Camelia Ram', 'René Rohrbeck', 'Remco Lenstra']","['EDHEC Business School', 'UNESCO']",Math and Logic,https://www.coursera.org/learn/strategic-foresight
Cybersecurity Compliance Framework & System Administration,4.7,Beginner level,20 hours (approximately),Flexible schedule,"3,129 reviews","List and describe several key cybersecurity compliance and industry standards including NIST, GDPR, HIPAA, SANS and PCI.Describe an overview of the design, roles and function of server and user administration.Understand the concept of patching and endpoint protection as it relates to client system administration.Define encryption, encoding, hashing and digital certificates as it relates to cryptography",[],"['Compliance Frameworks and Industry Standards', 'Client System Administration, Endpoint Protection and Patching', 'Server and User Administration', 'Cryptography and Compliance Pitfalls', 'Linux and Encryption: Final Project']",['IBM Skills Network Team'],['IBM'],Math and Logic,https://www.coursera.org/learn/cybersecurity-compliance-framework-system-administration
Security Principles,4.7,Beginner level,5 hours (approximately),Flexible schedule,250 reviews,,"['Risk', 'security', 'governance', 'Information Assurance']","['Course Introduction', 'Information Assurance', 'Risk Mitigation Process ', 'Security Controls', 'Governance', '(ISC)² Code of Ethics', 'Security Principles Review']",['(ISC)² Education & Training'],['ISC2'],Math and Logic,https://www.coursera.org/learn/-security-principles
Computational Thinking for Problem Solving,4.7,Beginner level,Approx. 17 hours to complete,Flexible schedule,"1,351 reviews",,"['Simple Algorithm', 'Python Programming', 'Problem Solving', 'Computation']","['Pillars of Computational Thinking', 'Expressing and Analyzing Algorithms', 'Fundamental Operations of a Modern Computer', 'Applied Computational Thinking Using Python']",['Susan Davidson'],['University of Pennsylvania'],Math and Logic,https://www.coursera.org/learn/computational-thinking-problem-solving
C for Everyone: Programming Fundamentals,4.5,Beginner level,15 hours (approximately),Flexible schedule,"6,262 reviews","Write a simple program.Compile, debug, and run a program.Apply concepts related to arrays & pointers, functions & storage classes, logic operators & various question types, lexical elements & data types.",[],"['Introduction', 'Lexical Elements and Data Types', 'Flow of Control and Simple Functions', 'Advanced Functions, Recursion, Arrays, and Pointers', 'Arrays and pointers', 'Final Exam']",['Ira Pohl'],"['University of California, Santa Cruz']",Math and Logic,https://www.coursera.org/learn/c-for-everyone
Engineering Health: Introduction to Yoga and Physiology,4.8,Beginner level,Approx. 53 hours to complete,Flexible schedule,481 reviews,"Identify the role, structure, and function of human physiological systemsIdentify the the conditions and presentation of normal and abnormal functioning of human physiological systemsExamine underlying physiological mechanisms that connect healthy functioning to yoga practicePractice yoga that targets therapy, prevention, and overall wellness",[],"['Introduction to the Course, Yoga and Physiology', 'The Cell and Homeostasis', 'Genetics', 'How to Read and Interpret the Research', 'The Nervous System', 'The Respiratory System', 'The Cardiovascular System', 'The Lymphatic and Immune Systems', 'The Musculoskeletal System', 'The Renal System', 'The Digestive System', 'The Endocrine and Reproductive Systems ', 'The Affect of Chronic Stress on Human Physiology', 'Summary']","['Alexandra Seidenstein', 'Eddie Stern', 'Tommy Lee ']",['New York University'],Math and Logic,https://www.coursera.org/learn/engineering-health-yoga-physiology
Data Structures,4.6,Intermediate level,24 hours (approximately),Flexible schedule,"5,342 reviews",,"['Priority Queue', 'Binary Search Tree', 'Hash Table', 'List', 'Stack (Abstract Data Type)']","['Basic Data Structures', 'Dynamic Arrays and Amortized Analysis', 'Priority Queues and Disjoint Sets', 'Hash Tables', 'Binary Search Trees', 'Binary Search Trees 2']","['Alexander S. Kulikov', 'Daniel M Kane', 'Neil Rhodes', 'Michael Levin']",['University of California San Diego'],Math and Logic,https://www.coursera.org/learn/data-structures
Introduction to Economic Theories,4.5,Beginner level,Approx. 40 hours to complete,Flexible schedule,329 reviews,,[],"['Introduction to Pluralist Economics', 'Micro Economics: Individuals, Households and Consumers ', 'Micro Economics: Firms and Markets ', 'Micro Economics: The state', 'Micro Economics: Factor Markets', 'Macro Economics: Real and Monetary Economy', 'Macro Economics: Growth and Trade ', 'Macro Economics: Nature and Wellbeing & Poverty']","['Rob van Tulder', 'Irene van Staveren', 'Maria Dafnomili']",['Erasmus University Rotterdam'],Math and Logic,https://www.coursera.org/learn/intro-economic-theories
Big Data – Introducción al uso práctico de datos masivos  Specialization,4.6,Beginner level,1 months at 10 hours a week,Flexible schedule,"1,596 reviews",,[],"['Big Data: el impacto de los datos masivos en la sociedad actual', 'Big Data: adquisición y almacenamiento de datos', 'Big Data: procesamiento y análisis', 'Big Data: visualización de datos', 'Big Data: capstone project']","['Ignasi Alcalde', 'Nadia Tonello', 'Quelic Berga Carreras', 'Jorge Carretero', 'Andrés Cencerrado', 'Tomás Margalef', 'Antonio Pita', 'Francesc Torradeflot', 'Isabel Serra', 'Santiago González', 'Teresa Sancho Vinuesa', 'Julià Minguillón Alfonso', 'Antonio Espinosa', 'Josep Curto Díaz', 'Llorenç Badiella', 'Pau Tallada', 'Carme Artigas Brugal']",['Universitat Autònoma de Barcelona'],Math and Logic,https://www.coursera.org/specializations/big-data-introduccion
"Python, Bash and SQL Essentials for Data Engineering Specialization",4.5,Beginner level,4 months at 5 hours a week,Flexible schedule,266 reviews,"Develop data engineering solutions with a minimal and essential subset of the Python language and the Linux environmentDesign scripts to connect and query a SQL database using PythonUse a scraping library in Python to read, identify and extract data from websites 
","['Data Science', 'Big Data', 'Python Programming', 'Bash (Unix Shell)', 'Database (DBMS)', 'Information Engineering', 'SQL', 'Web Application']","['Python and Pandas for Data Engineering', 'Linux and Bash for Data Engineering', 'Scripting with Python and SQL for Data Engineering', 'Web Applications and Command-Line Tools for Data Engineering']","['Alfredo Deza', 'Noah Gift', 'Kennedy Behrman']",['Duke University'],Math and Logic,https://www.coursera.org/specializations/python-bash-sql-data-engineering-duke
MBA Essentials,,Intermediate level,Approx. 9 hours to complete,Flexible schedule,,Identify what is required for and expected from an MBACritically assess alternative sources of information,[],"['Week 1: Business Models, Global Business and Supply Chains, and Global Economy', 'The Triple Bottom Line: Accounting and Analytics, SDGs, and Digital Innovation', 'Leading Change and Projects', 'Marketing and Stakeholders']",['Javier Yanez'],['University of Glasgow '],Math and Logic,https://www.coursera.org/learn/mba-essentials
Problem Solving with Excel ,4.7,Beginner level,20 hours (approximately),Flexible schedule,"5,255 reviews",,"['Data Analysis', 'Microsoft Excel', 'Pivot Table', 'Data Cleansing']","['Overview of Excel', 'vLookups and Data Cleansing', 'Logical Functions & Pivot Tables', 'More Advanced Formulas']",['Alex Mannella'],['PwC'],Math and Logic,https://www.coursera.org/learn/excel-analysis
Foundations for Assisting in Home Care,4.8,,Approx. 75 hours to complete,Flexible schedule,376 reviews,,[],"['Course Information Documents', 'Module 1 - Introduction to Home Health Care', 'Module 2 - Working Effectively with Home Care Clients', 'Module 3 - Working with the Elderly', 'Module 4 - Working with Children', 'Module 5 - Working with People Who Are Mentally Ill', 'Module 6 - Working with People with Developmental Disabilities', 'Module 7 - Working with People with Physical Disabilities', 'Module 8 - Food, Nutrition, and Meal Preparation', 'Module 9 - Family Spending and Budgeting ', 'Module 10 - Care of the Home and Personal Belongings', ' Module 11 - Safety and Injury Prevention ', 'Module 12 - Personal Care']","['Andrea C. Wade, Ph.D.', ""Erin O'Hara-Leslie"", 'Kimberly B. McLain, Ph.D.', 'Tera Doty-Blance']",['The State University of New York'],Math and Logic,https://www.coursera.org/learn/home-care
An Introduction to Accessibility and Inclusive Design,4.7,Beginner level,Approx. 15 hours to complete,Flexible schedule,194 reviews,,[],"['Course Orientation', 'Module 1: Understanding Disability and Assistive Technology', 'Module 2: The Legal Landscape and the Workplace', 'Module 3: Universal Design', 'Module 4: Accessible Digital Materials']","['Marc Thompson', 'Tania Heap', 'Lori Lane']",['University of Illinois at Urbana-Champaign'],Math and Logic,https://www.coursera.org/learn/accessibility
Architecting Solutions on AWS,4.9,Intermediate level,22 hours (approximately),Flexible schedule,198 reviews,,"['Software Architecture', 'Data Analysis', 'Data Visualization', 'AWS Account Management']","['Designing a serverless web backend on AWS', 'Designing a serverless data analytics solution on AWS', 'Designing a hybrid solution for container based workloads on AWS', 'Designing a solution following account governance and management best practices']","['Morgan Willis', 'Rafael Lopes']",['Amazon Web Services'],Math and Logic,https://www.coursera.org/learn/architecting-solutions-on-aws
Six Sigma and the Organization (Advanced),4.7,Intermediate level,16 hours (approximately),Flexible schedule,"3,354 reviews",,"['Lean Six Sigma', 'Process Improvement', 'Process Capability', 'Six Sigma']","['Six Sigma and the Organization', 'Lean Principles in the Organization', 'Design for Six Sigma', 'Project Identification - VOC - Project Management Basics', 'Management and Planning Tools & Business Results for Projects']","['David Cook, PhD', 'Bill Bailey, PhD']",['University System of Georgia'],Math and Logic,https://www.coursera.org/learn/six-sigma-organization-advanced
"ETL and Data Pipelines with Shell, Airflow and Kafka",4.5,Intermediate level,16 hours (approximately),Flexible schedule,274 reviews,"Describe and contrast Extract, Transform, Load (ETL) processes and Extract, Load, Transform (ELT) processes.Explain batch vs concurrent modes of execution.Implement an ETL pipeline through shell scripting.Describe data pipeline components, processes, tools, and technologies.","['Extract Transform and Load (ETL)', 'Data Engineer', 'Apache Kafka', 'Apache Airflow', 'Data Pipelines']","['Data Processing Techniques', 'ETL & Data Pipelines: Tools and Techniques', 'Building Data Pipelines using Airflow', 'Building Streaming Pipelines using Kafka', 'Final Assignment']","['Yan Luo', 'Sabrina Spillner', 'Jeff Grossman', 'Ramesh Sannareddy']",['IBM'],Math and Logic,https://www.coursera.org/learn/etl-and-data-pipelines-shell-airflow-kafka
Machine Learning: Theory and Hands-on Practice with Python Specialization,3.7,Intermediate level,3 months at 10 hours a week,Flexible schedule,39 reviews,Explore several classic Supervised and Unsupervised Learning algorithms and introductory Deep Learning topics.  Build and evaluate Machine Learning models utilizing popular Python libraries and compare each algorithm’s strengths and weaknesses.Explain which Machine Learning models would be best to apply to a Machine Learning task based on the data’s properties.Improve model performance by tuning hyperparameters and applying various techniques such as sampling and regularization.,"['Unsupervised Learning', 'Python Programming', 'Deep Learning', 'hyperparameter tuning', 'Supervised Learning']","['Introduction to Machine Learning: Supervised Learning', 'Unsupervised Algorithms in Machine Learning', 'Introduction to Deep Learning']",['Geena Kim '],['University of Colorado Boulder'],Math and Logic,https://www.coursera.org/specializations/machine-learnin-theory-and-hands-on-practice-with-pythong-cu
COBOL Programming with VSCode,4.7,Beginner level,Approx. 15 hours to complete,Flexible schedule,169 reviews,Summarize the key features of COBOL programRecognize the hardware (IBM Z) and software (z/OS) layers that go hand in hand with Enterprise COBOL Demonstrate an understanding of basic programming fundamentals Demonstrate an understanding of the modern tooling interface (VSCode w/ ZOWE & Z Open Editor),"['Computer Programming', 'Common Business Oriented Language (COBOL)', 'ZOWE', 'IBM Z', 'VSCode']","['COBOL Basics ', 'COBOL Structure and Cross-Program Communication', 'Defining and Manipulating COBOL Data Names/Types']",['Jeff Bisti'],['IBM '],Math and Logic,https://www.coursera.org/learn/cobol-programming-vscode
Introduction to Java and Object-Oriented Programming,4.4,Beginner level,19 hours (approximately),Flexible schedule,246 reviews,"Identify core aspects of object-oriented programming and features of the Java language.Use Eclipse for writing and running Java code.Develop programs that use Java collections and apply core object-oriented programming concepts using classes, polymorphism, and method overloading.Test code by applying principles of test-driven development using Java's unit testing framework.","['Unit Testing', 'Java Syntax', 'Java Programming', 'Object-Oriented Programming (OOP)', 'Java Tools']","['Module 1 :  Introduction to Java, Classes, & Eclipse', 'Module 2 : Unit Testing, Arrays, & ArrayLists', 'Module 3 : Static Variables, Methods, & Polymorphism Using Overloading']",['Brandon Krakowsky'],['University of Pennsylvania'],Math and Logic,https://www.coursera.org/learn/java-object-oriented-programming
